keyword,last_used,times_used,companies_found
heavy furniture shipping solutions,2026-01-22 17:26:07,1,8
oversized package delivery services,2026-01-22 17:26:07,1,8
fragile electronics shipping companies,2026-01-22 17:26:07,1,8
fitness equipment direct to consumer,2026-01-24 11:14:09,2,12
online furniture store USA,2026-01-22 17:26:07,1,8
large item shipping specialists,2026-01-22 17:26:07,1,8
bulky goods logistics,2026-01-22 17:26:07,1,8
e-commerce fitness equipment suppliers,2026-01-22 17:26:07,1,8
furniture delivery companies for online stores,2026-01-22 17:26:07,1,8
consumer electronics shipping quotes,2026-01-22 17:26:07,1,8
heavy furniture online store,2026-01-24 11:14:09,3,5
oversized electronics DTC,2026-01-24 11:14:09,3,5
home gym equipment official site,2026-01-24 11:07:17,3,2
large appliance retailers online,2026-01-22 17:32:08,1,1
bulk fitness equipment suppliers USA,2026-01-22 17:32:08,1,1
freight shipping furniture Shopify,2026-01-24 12:30:08,2,1
white glove delivery electronics direct to consumer,2026-01-22 17:32:08,1,1
damaged furniture claims assistance,2026-01-22 17:32:08,1,1
high shipping costs fitness equipment,2026-01-24 11:28:37,2,1
affordable freight quotes furniture,2026-01-22 17:32:08,1,1
fitness equipment official site,2026-01-24 12:01:49,2,0
large appliance shipping solutions,2026-01-24 12:38:15,3,0
bulky item delivery USA,2026-01-23 08:20:58,1,0
furniture direct to consumer brands,2026-01-23 08:20:58,1,0
sectional sofas online shop,2026-01-24 12:00:45,3,0
treadmills for home online,2026-01-23 08:20:58,1,0
big screen tvs online store,2026-01-23 08:20:58,1,0
mattress in a box brands shopify,2026-01-23 08:20:58,1,0
oversized furniture online store,2026-01-24 08:47:22,1,0
large appliance direct to consumer,2026-01-24 12:00:45,3,0
sectional sofas shopify,2026-01-24 12:01:17,2,0
treadmills online retailer,2026-01-24 08:47:22,1,0
ellipticals for sale direct,2026-01-24 08:47:22,1,0
weight benches shopify,2026-01-24 12:14:50,2,0
power racks online store,2026-01-24 08:47:22,1,0
adjustable dumbbells DTC,2026-01-24 08:47:22,1,0
kettlebells official site,2026-01-24 08:47:22,1,0
gourmet cheese subscription box USA,2026-01-24 11:59:47,3,3
fresh seafood delivery DTC,2026-01-24 12:39:33,2,3
artisan bread online store,2026-01-24 12:15:26,3,3
organic meal kit official site,2026-01-24 08:58:55,1,3
specialty coffee subscription box,2026-01-24 08:58:55,1,3
exotic fruit delivery USA,2026-01-24 08:58:55,1,3
microgreen subscription box Shopify,2026-01-24 08:58:55,1,3
rare plant subscription box online,2026-01-24 12:27:33,3,3
succulent subscription box DTC,2026-01-24 12:02:51,3,3
air plant online store,2026-01-24 08:58:55,1,3
eco friendly activewear brands USA,2026-01-24 12:01:59,2,5
sustainable swimwear online store,2026-01-24 09:07:28,1,5
organic baby clothes shopify,2026-01-24 11:52:48,3,5
ethical lingerie direct to consumer,2026-01-24 12:18:42,3,5
fair trade clothing official site,2026-01-24 11:56:57,2,5
recycled denim jeans online,2026-01-24 09:07:28,1,5
vegan leather shoes store,2026-01-24 09:07:28,1,5
sustainable yoga pants brand,2026-01-24 09:07:28,1,5
eco conscious outerwear shopify,2026-01-24 09:07:28,1,5
organic cotton t shirts USA,2026-01-24 09:07:28,1,5
premium pet food direct to consumer,2026-01-24 11:59:02,3,2
artisanal coffee beans online store,2026-01-24 09:23:58,1,2
gourmet chocolate gifts shopify,2026-01-24 09:23:58,1,2
handmade jewelry official site USA,2026-01-24 12:39:44,2,2
organic skincare products DTC brand,2026-01-24 09:23:58,1,2
sustainable home goods ecommerce,2026-01-24 12:06:21,3,2
specialty tea blends online shop,2026-01-24 12:38:33,3,2
small batch hot sauce direct to consumer,2026-01-24 11:57:34,3,2
luxury candles official site USA,2026-01-24 12:29:25,3,4
premium men's grooming products shopify,2026-01-24 12:07:27,2,2
UK baby clothing brand US shipping,2026-01-24 11:55:38,3,0
EU direct to consumer cosmetics US,2026-01-24 09:38:42,1,0
Australian swimwear official site US,2026-01-24 12:00:05,3,0
German kitchenware online shop USA,2026-01-24 09:38:42,1,0
French skincare brand ships to USA,2026-01-24 09:38:42,1,0
Japanese stationery DTC USA,2026-01-24 09:38:42,1,0
Korean beauty official website USA,2026-01-24 09:38:42,1,0
Canadian outdoor gear online store US,2026-01-24 12:40:28,3,0
Mexican artisanal goods US distributor,2026-01-24 09:38:42,1,0
Brazilian footwear direct to consumer USA,2026-01-24 09:38:42,1,0
large sectional sofa online store,2026-01-24 11:55:43,3,5
home gym equipment direct to consumer,2026-01-24 11:59:43,3,0
official site adjustable dumbbells,2026-01-24 09:50:55,1,0
heavy planters shopify,2026-01-24 09:50:55,1,0
outdoor furniture set online store,2026-01-24 09:50:55,1,0
electric scooter direct to consumer,2026-01-24 12:24:49,2,0
treadmill for home use official site,2026-01-24 12:13:13,2,0
oversized bean bag chair shopify,2026-01-24 09:50:55,1,0
large format 3d printer online store,2026-01-24 09:50:55,1,0
gaming desk direct to consumer,2026-01-24 09:50:55,1,0
fresh seafood subscription box DTC,2026-01-24 12:18:36,2,0
gourmet mushroom growing kit online store,2026-01-24 11:56:51,3,0
artisan cheese delivery service official site,2026-01-24 09:53:59,1,0
rare plant subscription box shopify,2026-01-24 11:56:18,3,0
organic baby food delivery USA,2026-01-24 12:01:04,3,0
craft beer of the month club online store,2026-01-24 11:56:18,3,0
specialty coffee bean subscription DTC,2026-01-24 12:19:45,3,0
exotic fruit subscription box USA,2026-01-24 11:41:47,3,2
microgreen growing kit shopify,2026-01-24 12:23:53,3,0
edible flower delivery online store,2026-01-24 09:53:59,1,0
eco friendly yoga apparel online store,2026-01-24 11:03:52,3,0
sustainable swimwear brands direct to consumer,2026-01-24 12:01:29,3,0
organic linen clothing official site,2026-01-24 12:08:57,2,0
ethical baby clothes shopify,2026-01-24 10:01:22,1,0
carbon neutral shipping fashion brand,2026-01-24 12:40:49,2,0
sustainable denim brands online store USA,2026-01-24 10:01:22,1,0
eco conscious activewear DTC,2026-01-24 10:01:22,1,0
recycled cashmere sweaters official site,2026-01-24 10:01:22,1,0
fair trade cotton dresses shopify,2026-01-24 12:24:28,2,0
organic bamboo socks online store,2026-01-24 12:28:16,2,0
premium coffee beans direct to consumer,2026-01-24 12:10:49,3,0
gourmet spice blends online store,2026-01-24 12:04:14,3,0
artisanal cheese shop USA,2026-01-24 10:03:51,1,0
small batch skincare shopify,2026-01-24 11:59:58,2,0
luxury candle brand DTC,2026-01-24 10:03:51,1,0
organic tea blends online store,2026-01-24 12:31:34,2,0
handmade jewelry shop USA,2026-01-24 10:03:51,1,0
specialty food gifts direct to consumer,2026-01-24 12:19:23,3,0
high-end pet accessories shopify,2026-01-24 10:03:51,1,0
sustainable home goods official site,2026-01-24 11:45:36,3,3
UK beauty brand USA official site,2026-01-24 10:05:53,1,0
EU sustainable fashion DTC USA,2026-01-24 12:04:52,2,0
MENA luxury dates online store USA,2026-01-24 10:05:53,1,0
APAC innovative tech gadgets USA,2026-01-24 10:05:53,1,0
Australian swimwear official website USA,2026-01-24 12:35:33,2,0
New Zealand skincare Shopify USA,2026-01-24 10:05:53,1,0
German kitchenware online store USA,2026-01-24 12:07:02,3,0
French artisanal cheese direct to consumer USA,2026-01-24 10:05:53,1,0
Italian leather goods official site USA,2026-01-24 12:05:55,2,0
Spanish olive oil online shop USA,2026-01-24 10:05:53,1,0
oversized sectional couches online store,2026-01-24 10:06:03,1,0
large screen tv official site,2026-01-24 11:54:39,3,0
electric fireplace shopify,2026-01-24 10:06:03,1,0
weightlifting equipment online store USA,2026-01-24 10:06:03,1,0
rattan furniture brand DTC,2026-01-24 10:06:03,1,0
ergonomic office chair online store,2026-01-24 10:06:03,1,0
outdoor patio furniture shopify,2026-01-24 12:22:23,2,0
portable generator official site,2026-01-24 12:10:28,2,0
inflatable hot tub direct to consumer,2026-01-24 10:06:03,1,0
gourmet cheese subscription box direct to consumer,2026-01-24 12:14:26,3,3
craft beer of the month club official site,2026-01-24 12:02:51,3,7
artisan chocolate subscription box USA shopify,2026-01-24 10:09:17,1,3
fresh seafood delivery subscription online store,2026-01-24 10:09:17,1,3
organic meal kit delivery service DTC,2026-01-24 10:09:17,1,3
specialty coffee subscription box online shop,2026-01-24 10:09:17,1,3
vegan snack box subscription direct,2026-01-24 10:09:17,1,3
wine of the month club official website,2026-01-24 10:09:17,1,3
exotic fruit subscription box direct to consumer,2026-01-24 12:09:31,3,3
microgreens subscription delivery Shopify,2026-01-24 10:09:17,1,3
sustainable swimwear direct to consumer,2026-01-24 11:03:52,3,0
ethical lingerie official site,2026-01-24 12:18:10,3,0
recycled denim jeans DTC,2026-01-24 10:14:31,1,0
fair trade knitwear brands USA,2026-01-24 12:22:36,2,0
plant based shoe online store,2026-01-24 10:14:31,1,0
biodegradable phone case shopify,2026-01-24 10:14:31,1,0
sustainable jewelry official site,2026-01-24 10:14:31,1,0
eco conscious beauty products DTC,2026-01-24 10:14:31,1,0
premium tea subscription box official site,2026-01-24 12:16:40,3,4
gourmet coffee beans direct to consumer,2026-01-24 12:06:54,3,6
artisan chocolate online store USA,2026-01-24 12:30:58,2,4
small batch hot sauce shopify,2026-01-24 11:11:52,3,4
sustainable bamboo kitchenware online,2026-01-24 10:17:45,1,4
eco-friendly cleaning products DTC,2026-01-24 11:11:52,2,4
organic baby food online store,2026-01-24 11:52:53,3,7
natural skincare shopify plus,2026-01-24 10:17:45,1,4
luxury bath bombs direct to consumer,2026-01-24 10:17:45,1,4
UK beauty products US distributor,2026-01-24 12:08:39,3,0
EU furniture brands US expansion,2026-01-24 10:26:59,1,0
MENA fashion retailers US shipping,2026-01-24 10:26:59,1,0
APAC consumer electronics official site USA,2026-01-24 10:26:59,1,0
Australian swimwear direct to consumer USA,2026-01-24 11:38:53,3,0
New Zealand baby clothing DTC US,2026-01-24 10:26:59,1,0
European kitchenware brands Shopify US,2026-01-24 10:26:59,1,0
British pet supplies official website US,2026-01-24 10:26:59,1,0
German automotive accessories online shop USA,2026-01-24 10:26:59,1,0
oversized sectional sofa online store,2026-01-24 11:58:45,3,2
heavy duty storage rack direct to consumer,2026-01-24 10:27:07,1,1
electric treadmill official site,2026-01-24 12:21:46,2,1
large format printer ecommerce,2026-01-24 10:27:07,1,1
assembled furniture direct to consumer,2026-01-24 10:27:07,1,1
premium weight bench online shop,2026-01-24 10:27:07,1,1
heavy duty tool chest direct to consumer,2026-01-24 12:02:18,2,1
large screen tv online store,2026-01-24 12:37:44,3,1
inflatable hot tub official site,2026-01-24 10:27:07,1,1
outdoor patio set shopify,2026-01-24 10:27:07,1,1
monthly cheese subscription box USA,2026-01-24 12:08:21,3,0
artisan bread delivery service DTC,2026-01-24 11:55:48,3,0
gourmet mushroom grow kit subscription,2026-01-24 10:32:05,1,0
exotic fruit online store,2026-01-24 12:04:01,2,0
microgreens subscription box official site,2026-01-24 12:02:23,3,0
rare plant subscription box USA,2026-01-24 11:54:13,3,2
organic herb garden kit online store,2026-01-24 12:22:29,3,0
air plant subscription box shopify,2026-01-24 12:04:33,3,2
succulent subscription box direct to consumer,2026-01-24 12:14:26,3,0
fresh pasta delivery service USA,2026-01-24 12:24:54,2,0
eco friendly yoga clothing online store,2026-01-24 11:59:26,3,0
organic cotton baby clothes shopify store,2026-01-24 11:57:59,3,2
recycled polyester activewear official site,2026-01-24 12:06:15,3,0
ethical denim jeans online shop,2026-01-24 10:33:35,1,0
fair trade linen dresses USA,2026-01-24 10:33:35,1,0
biodegradable packaging apparel brands,2026-01-24 10:33:35,1,0
carbon neutral shipping clothing company,2026-01-24 10:33:35,1,0
sustainable fashion accessories online,2026-01-24 10:33:35,1,0
eco-conscious footwear direct to consumer,2026-01-24 10:33:35,1,0
gourmet food gifts online shop,2026-01-24 11:58:07,2,0
artisan skincare products official site,2026-01-24 10:40:19,1,0
handmade jewelry ecommerce store USA,2026-01-24 10:40:19,1,0
specialty tea blends shopify,2026-01-24 12:15:09,3,0
small batch hot sauce DTC brand,2026-01-24 12:18:47,3,0
organic spice blends online store,2026-01-24 10:40:19,1,0
sustainable home goods shopify,2026-01-24 12:12:58,3,0
eco-friendly cleaning products official site,2026-01-24 11:52:53,3,0
natural pet supplies ecommerce store,2026-01-24 10:40:19,1,0
UK artisan cheese online shop USA shipping,2026-01-24 10:40:26,1,0
EU natural skincare direct to consumer USA,2026-01-24 10:40:26,1,0
Middle East date sweets online store USA,2026-01-24 10:40:26,1,0
APAC handmade jewelry official site USA,2026-01-24 12:14:44,2,0
German leather goods Shopify USA,2026-01-24 10:40:26,1,0
French linen bedding online shop USA,2026-01-24 12:25:45,2,0
Italian espresso machines direct to consumer USA,2026-01-24 10:40:26,1,0
Australian organic baby food online store USA,2026-01-24 10:40:26,1,0
Scandinavian minimalist furniture official site USA,2026-01-24 10:40:26,1,0
Spanish olive oil DTC USA,2026-01-24 10:40:26,1,0
assembled home gym equipment for sale,2026-01-24 10:43:32,1,5
electronic drum set official site,2026-01-24 10:43:32,1,5
prefabricated sauna kits direct to consumer,2026-01-24 10:43:32,1,5
rattan furniture online shop USA,2026-01-24 12:31:15,2,5
heavy duty tool storage cabinets online,2026-01-24 10:43:32,1,5
oversized bean bag chairs DTC,2026-01-24 12:22:53,2,5
electric fireplace insert shopify,2026-01-24 10:43:32,1,5
portable basketball hoop official site,2026-01-24 10:43:32,1,5
memory foam mattress online retailer,2026-01-24 10:43:32,1,5
monthly cheese subscription box direct to consumer,2026-01-24 12:18:05,3,0
artisan bread delivery service USA,2026-01-24 12:14:26,3,0
fresh pasta subscription box Shopify,2026-01-24 12:36:15,3,0
microgreen subscription box official site,2026-01-24 10:50:13,1,0
exotic fruit box delivery online,2026-01-24 12:05:36,2,0
craft beer of the month club DTC,2026-01-24 12:06:09,3,0
specialty coffee bean subscription box USA,2026-01-24 12:06:43,3,0
vegan meal prep delivery service Shopify,2026-01-24 10:50:13,1,0
organic spice subscription box online store,2026-01-24 10:50:13,1,0
organic baby clothes shopify usa,2026-01-24 11:55:26,2,0
ethical fashion jewelry online store,2026-01-24 12:23:03,3,0
recycled denim jeans official site,2026-01-24 12:19:51,3,0
sustainable lingerie brands usa,2026-01-24 10:52:40,1,0
eco-friendly activewear shop online,2026-01-24 10:52:40,1,0
organic cotton t shirts direct to consumer,2026-01-24 12:02:58,2,0
sustainable men's clothing shopify,2026-01-24 10:52:40,1,0
eco friendly women's shoes online store,2026-01-24 12:39:39,2,0
natural skincare direct to consumer USA,2026-01-24 10:56:35,1,0
gourmet coffee beans online store,2026-01-24 11:53:54,3,3
premium pet food shopify plus,2026-01-24 12:23:34,2,0
artisan chocolate official site USA,2026-01-24 11:53:54,2,0
handmade jewelry DTC brand,2026-01-24 12:09:43,3,0
specialty tea online retailer,2026-01-24 10:56:35,1,0
organic baby food direct to consumer,2026-01-24 12:21:01,3,0
sustainable home goods online store USA,2026-01-24 10:56:35,1,0
UK baby clothing brand USA,2026-01-24 12:17:17,3,0
EU handcrafted leather goods official site,2026-01-24 10:57:49,1,0
MENA organic skincare direct to consumer,2026-01-24 10:57:49,1,0
APAC sustainable swimwear online store,2026-01-24 10:57:49,1,0
Australian coffee beans shopify USA,2026-01-24 10:57:49,1,0
New Zealand wool apparel DTC,2026-01-24 10:57:49,1,0
German kitchen knives official website USA,2026-01-24 10:57:49,1,0
French linen bedding online shop,2026-01-24 10:57:49,1,0
Italian leather shoes direct to consumer,2026-01-24 10:57:49,1,0
Spanish olive oil shopify USA,2026-01-24 12:31:08,3,0
heavy furniture online store USA,2026-01-24 11:54:07,3,0
oversized fitness equipment official site,2026-01-24 12:40:36,2,0
bulky home goods shopify,2026-01-24 11:00:13,1,0
freight shipping for e-commerce furniture,2026-01-24 12:34:00,2,0
white glove delivery fitness equipment brands,2026-01-24 11:00:13,1,0
specialized carriers for large consumer electronics,2026-01-24 11:00:13,1,0
fragile goods shipping solutions online store,2026-01-24 11:00:13,1,0
high value item logistics official site,2026-01-24 11:00:13,1,0
direct to consumer sectional sofas,2026-01-24 11:00:13,1,0
gourmet cheese subscription box USA official site,2026-01-24 11:59:21,3,0
artisan bread delivery service online store,2026-01-24 11:58:51,3,0
fresh pasta subscription box shopify,2026-01-24 12:10:36,3,0
organic baby food delivery direct to consumer,2026-01-24 11:01:35,1,0
specialty coffee bean subscription official site,2026-01-24 11:56:18,3,0
small batch spice blends online store,2026-01-24 12:15:57,3,0
exotic fruit box subscription DTC,2026-01-24 11:58:23,2,0
microgreen growing kit online store,2026-01-24 12:05:03,3,0
organic baby clothes shopify store usa,2026-01-24 11:03:52,1,0
ethical lingerie brands official site,2026-01-24 12:23:58,2,0
carbon neutral shoe brands online,2026-01-24 12:04:39,3,0
recycled material backpack online shop,2026-01-24 11:03:52,1,0
sustainable plus size clothing direct to consumer,2026-01-24 12:24:28,2,0
eco friendly activewear online store,2026-01-24 11:03:52,1,0
organic cotton t shirts official site,2026-01-24 12:13:25,3,0
ethical jewelry brands shopify,2026-01-24 11:03:52,1,0
premium tea blends online shop USA,2026-01-24 12:11:54,2,2
artisan chocolate subscription box shopify,2026-01-24 11:04:02,1,2
small batch skincare official site USA,2026-01-24 12:34:56,3,2
handmade jewelry online store,2026-01-24 12:11:55,3,2
sustainable home goods DTC brand,2026-01-24 11:59:02,3,2
eco-friendly baby products shopify store,2026-01-24 11:04:02,1,2
organic cotton clothing online shop,2026-01-24 11:04:02,1,2
natural supplements direct to consumer,2026-01-24 12:38:33,3,2
UK skincare brands shipping to USA official site,2026-01-24 12:32:45,3,0
EU direct to consumer cosmetics USA warehouse,2026-01-24 11:07:08,1,0
Australian baby clothing online store USA delivery,2026-01-24 11:07:08,1,0
German kitchenware official website USA,2026-01-24 11:07:08,1,0
Japanese stationery shopify USA,2026-01-24 12:37:37,3,0
Canadian outdoor gear DTC USA shipping,2026-01-24 11:07:08,1,0
French linen bedding USA online store,2026-01-24 11:07:08,1,0
Scandinavian furniture direct to consumer USA,2026-01-24 11:07:08,1,0
Swiss chocolate brands USA official site,2026-01-24 11:07:08,1,0
Italian leather shoes online store USA,2026-01-24 12:08:39,3,0
large screen tv direct to consumer,2026-01-24 12:05:30,3,1
heavy duty shelving units shopify,2026-01-24 11:07:17,1,1
adjustable dumbbells online store usa,2026-01-24 11:07:17,1,1
solid wood dining table dtc,2026-01-24 11:07:17,1,1
electric scooter official site,2026-01-24 12:08:15,3,1
portable generator online store,2026-01-24 11:07:17,1,1
inflatable kayak shopify,2026-01-24 11:07:17,1,1
weighted blanket direct to consumer,2026-01-24 11:07:17,1,1
artisan bread delivery service official site,2026-01-24 12:20:45,3,0
fresh pasta subscription box online store,2026-01-24 12:07:14,3,0
specialty coffee bean subscription shopify,2026-01-24 12:04:33,3,0
microgreen growing kit subscription usa,2026-01-24 11:09:39,1,0
exotic fruit box delivery direct to consumer,2026-01-24 12:05:03,2,0
organic spice subscription box shopify,2026-01-24 12:35:45,2,0
rare plant subscription box usa,2026-01-24 12:38:21,2,0
mushroom growing kit direct to consumer,2026-01-24 11:53:43,2,0
eco-friendly yoga apparel direct to consumer,2026-01-24 12:34:12,3,0
sustainable swimwear brands online store USA,2026-01-24 11:11:19,1,0
organic baby clothing shopify store,2026-01-24 12:18:42,3,0
ethical cashmere sweaters official site,2026-01-24 11:11:19,1,0
recycled polyester activewear brands DTC,2026-01-24 11:11:19,1,0
sustainable denim jeans online shop USA,2026-01-24 11:11:19,1,0
eco-conscious lingerie brands direct to consumer,2026-01-24 11:11:19,1,0
organic cotton t-shirts shopify store,2026-01-24 12:21:26,2,0
fair trade clothing online boutique USA,2026-01-24 11:11:19,1,0
bamboo fiber socks official site,2026-01-24 11:11:19,1,0
premium matcha tea official site,2026-01-24 11:11:52,1,0
artisanal coffee beans direct to consumer,2026-01-24 12:05:48,3,0
natural skincare routine online shop,2026-01-24 11:11:52,1,0
vegan protein powder direct to consumer,2026-01-24 12:25:39,2,0
gluten-free baking mixes shopify,2026-01-24 11:11:52,1,0
UK skincare brand US shipping,2026-01-24 12:07:02,3,0
EU fashion boutique US delivery,2026-01-24 11:12:03,1,0
MENA beauty products US online store,2026-01-24 11:12:03,1,0
APAC home goods official site USA,2026-01-24 12:39:21,2,0
Canadian outdoor gear shopify USA,2026-01-24 12:02:12,2,0
German kitchenware brand ships to US,2026-01-24 11:12:03,1,0
French children's clothing online store USA,2026-01-24 11:12:03,1,0
Italian leather goods DTC USA,2026-01-24 12:29:02,3,0
Japanese stationery brand US warehouse,2026-01-24 11:12:03,1,0
large appliance official site,2026-01-24 12:20:39,3,4
sectional sofas online retailer,2026-01-24 11:54:07,3,4
treadmills for home shopify,2026-01-24 12:16:53,2,4
75 inch TVs online store,2026-01-24 11:14:09,1,4
king size mattresses direct to consumer,2026-01-24 11:54:07,2,4
weight benches official site,2026-01-24 12:09:24,3,4
refrigerators DTC brand,2026-01-24 11:14:09,1,4
monthly cheese subscription box DTC,2026-01-24 12:27:33,2,0
fresh pasta delivery service online store,2026-01-24 12:13:18,2,0
gourmet mushroom grow kit shopify,2026-01-24 12:11:43,2,0
microgreen growing kit delivery,2026-01-24 11:21:13,1,0
artisan bread subscription online shop,2026-01-24 11:21:13,1,0
rare plant subscription box official site,2026-01-24 12:07:45,3,0
houseplant delivery direct to consumer,2026-01-24 11:21:13,1,0
air purifying plant subscription box,2026-01-24 11:21:13,1,0
sustainable swimwear brands USA shopify,2026-01-24 11:23:48,1,0
organic baby clothes DTC,2026-01-24 12:36:21,2,0
eco conscious maternity wear official site,2026-01-24 11:23:48,1,0
sustainable plus size clothing online shop,2026-01-24 11:23:48,1,0
recycled plastic activewear brands,2026-01-24 11:23:48,1,0
bamboo clothing company online,2026-01-24 11:23:48,1,0
fair trade clothing online store,2026-01-24 12:02:58,3,0
vegan clothing brands shopify,2026-01-24 11:23:48,1,0
organic cotton t shirts DTC,2026-01-24 12:37:57,2,0
premium coffee beans online store USA,2026-01-24 11:45:36,2,3
gourmet spice blends direct to consumer,2026-01-24 12:03:04,3,0
artisanal skincare shopify,2026-01-24 11:26:10,1,0
handmade jewelry official site,2026-01-24 12:21:01,3,0
small batch hot sauce online store,2026-01-24 11:53:54,3,3
sustainable pet supplies DTC,2026-01-24 12:28:21,2,0
organic baby food online shop USA,2026-01-24 12:02:34,2,0
luxury home fragrance official site,2026-01-24 11:26:11,1,0
high-end tea blends direct to consumer,2026-01-24 11:26:11,1,0
unique gift boxes online store,2026-01-24 11:26:11,1,0
UK baby clothing brands ship to USA,2026-01-24 12:22:14,3,0
EU direct to consumer cosmetics USA shipping,2026-01-24 11:26:20,1,0
MENA dates online store USA delivery,2026-01-24 12:04:19,3,0
APAC tea official site USA,2026-01-24 11:26:20,1,0
Australian suncare Shopify USA,2026-01-24 11:26:20,1,0
New Zealand wool apparel online store USA,2026-01-24 11:26:20,1,0
Canadian outdoor gear DTC USA,2026-01-24 12:07:02,3,0
Scandinavian minimalist furniture online shop USA,2026-01-24 11:26:20,1,0
German kitchenware official site USA,2026-01-24 12:27:22,3,0
French linen bedding Shopify USA,2026-01-24 11:26:20,1,0
oversized electronics DTC brands,2026-01-24 12:32:18,2,0
large screen TVs online store,2026-01-24 12:01:17,2,0
elliptical machines shopify,2026-01-24 11:28:37,1,0
bulky item shipping problems furniture,2026-01-24 11:28:37,1,0
freight shipping furniture online,2026-01-24 11:28:37,1,0
white glove delivery electronics retailer,2026-01-24 11:28:37,1,0
pallet shipping fitness equipment,2026-01-24 11:28:37,1,0
fresh meal kit delivery service DTC,2026-01-24 11:56:51,2,2
gourmet cheese subscription box official site,2026-01-24 12:33:28,3,2
artisan bread delivery online store,2026-01-24 11:29:51,1,2
exotic fruit subscription box shopify,2026-01-24 12:25:27,3,2
microgreen growing kit direct to consumer,2026-01-24 11:53:43,3,2
organic baby food subscription box,2026-01-24 12:33:28,3,2
specialty coffee bean subscription online,2026-01-24 12:00:16,2,2
fresh seafood delivery subscription box,2026-01-24 12:03:27,3,4
heirloom vegetable seed subscription USA,2026-01-24 11:29:51,1,2
eco-friendly linen clothing online store USA,2026-01-24 11:32:30,1,2
sustainable hemp apparel DTC,2026-01-24 11:32:30,1,2
recycled swimwear official site,2026-01-24 12:34:45,3,2
ethical wool sweater direct to consumer,2026-01-24 11:32:30,1,2
vegan leather bags online shop USA,2026-01-24 11:32:30,1,2
fair trade jewelry website,2026-01-24 11:32:30,1,2
sustainable activewear brand shopify,2026-01-24 11:32:30,1,2
eco-friendly yoga pants online store,2026-01-24 12:16:33,2,2
organic bamboo socks official site,2026-01-24 12:16:02,3,2
premium skincare direct to consumer,2026-01-24 12:00:28,3,3
artisanal chocolate shopify plus,2026-01-24 12:14:38,3,3
high-end stationery official site,2026-01-24 12:08:33,3,3
luxury candles direct to consumer brand,2026-01-24 12:23:34,2,3
organic baby food online shop usa,2026-01-24 11:36:49,1,3
sustainable bedding sets shopify,2026-01-24 11:36:49,1,3
ethical jewelry brands direct to consumer,2026-01-24 12:31:26,2,3
specialty tea shopify usa,2026-01-24 11:36:49,1,3
UK beauty products ship to USA,2026-01-24 12:37:37,2,0
