keyword,last_used,times_used,companies_found
Scandinavian furniture DTC US shipping,2026-01-24 12:08:39,1,0
Japanese stationery US online shop,2026-01-24 12:08:39,1,0
Korean cosmetics direct to consumer USA fulfillment,2026-01-24 12:08:39,1,0
Mexican artisanal goods US online,2026-01-24 12:08:39,1,0
British tea brands US stockist,2026-01-24 12:08:39,1,0
Dutch cycling accessories online store US,2026-01-24 12:18:22,2,0
sectional sofa shopify,2026-01-24 12:26:21,2,0
large appliance online store,2026-01-24 12:38:51,3,0
85 inch tv official site,2026-01-24 12:08:45,1,0
outdoor furniture online store,2026-01-24 12:37:45,2,0
refrigerators direct to consumer,2026-01-24 12:24:18,3,0
monthly cheese subscription box online store,2026-01-24 12:08:51,1,0
gourmet mushroom growing kit direct to consumer,2026-01-24 12:08:51,1,0
microgreens subscription service USA,2026-01-24 12:18:05,2,0
artisan bread delivery subscription official site,2026-01-24 12:18:05,2,0
craft jerky subscription box shopify,2026-01-24 12:08:51,1,0
heirloom vegetable seed subscription direct to consumer,2026-01-24 12:08:51,1,0
gourmet tea subscription box online store,2026-01-24 12:08:51,1,0
organic cotton baby clothes shopify stores,2026-01-24 12:08:57,1,0
ethical footwear brands official site,2026-01-24 12:08:57,1,0
fair trade clothing boutiques USA,2026-01-24 12:08:57,1,0
vegan leather handbags direct to consumer brands,2026-01-24 12:08:57,1,0
sustainable activewear brands shopify,2026-01-24 12:15:00,2,0
eco-friendly kids clothing online store USA,2026-01-24 12:08:57,1,0
luxury coffee subscription box official site,2026-01-24 12:09:03,1,0
gourmet food gifts online store,2026-01-24 12:30:58,3,0
artisanal chocolate shopify brand,2026-01-24 12:09:03,1,0
ethical fashion brands shopify,2026-01-24 12:09:03,1,0
high-end supplements direct to consumer,2026-01-24 12:09:03,1,0
personalized stationery ecommerce brand,2026-01-24 12:09:03,1,0
EU fashion boutique US direct,2026-01-24 12:09:09,1,0
Middle East perfume online store USA,2026-01-24 12:09:10,1,0
Asia Pacific electronics official site USA,2026-01-24 12:09:10,1,0
Shopify pet supplies USA import,2026-01-24 12:09:10,1,0
DTC organic baby clothes USA,2026-01-24 12:09:10,1,0
Direct to consumer coffee subscription USA,2026-01-24 12:09:10,1,0
Online store artisanal cheese US,2026-01-24 12:09:10,1,0
Official site handmade jewelry US,2026-01-24 12:09:10,1,0
Sustainable home goods UK to US,2026-01-24 12:09:10,1,0
Ethical clothing brand Europe US,2026-01-24 12:09:10,1,0
large screen tv DTC brand,2026-01-24 12:14:17,2,0
power rack online store,2026-01-24 12:09:24,1,0
king size mattress online store,2026-01-24 12:30:37,2,0
outdoor furniture shopify,2026-01-24 12:25:21,2,0
gaming chair online retailer,2026-01-24 12:09:24,1,0
fresh seafood subscription box online store,2026-01-24 12:35:45,2,0
gourmet mushroom growing kit DTC,2026-01-24 12:41:47,2,0
artisan cheese monthly delivery service,2026-01-24 12:09:30,1,0
microgreens home delivery shopify,2026-01-24 12:09:30,1,0
organic sourdough starter kit online shop,2026-01-24 12:12:46,2,0
small batch coffee bean subscription,2026-01-24 12:09:31,1,0
specialty hot sauce subscription box,2026-01-24 12:09:31,1,0
vegan meal prep delivery service,2026-01-24 12:33:00,2,0
gluten free baking subscription box,2026-01-24 12:09:31,1,0
sustainable men's fashion DTC brands,2026-01-24 12:39:03,2,0
ethical activewear direct to consumer,2026-01-24 12:28:50,3,0
carbon neutral shipping apparel brands,2026-01-24 12:09:36,1,0
eco-conscious lingerie brands USA,2026-01-24 12:09:36,1,0
organic cotton t-shirts shopify,2026-01-24 12:09:36,1,0
recycled polyester clothing DTC,2026-01-24 12:09:36,1,0
ethical shoe brands online store USA,2026-01-24 12:09:36,1,0
organic baby clothing online shop USA,2026-01-24 12:10:49,2,0
specialty tea blends official website,2026-01-24 12:09:43,1,0
eco-friendly cleaning products shopify store,2026-01-24 12:39:12,2,0
natural supplements online retailer USA,2026-01-24 12:09:43,1,0
luxury candles DTC brand,2026-01-24 12:09:43,1,0
artisan chocolates online shop USA,2026-01-24 12:15:09,2,0
UK baby clothing US shipping,2026-01-24 12:09:48,1,0
APAC home goods online store USA,2026-01-24 12:09:48,1,0
British apparel US warehouse,2026-01-24 12:09:48,1,0
German footwear DTC US fulfillment,2026-01-24 12:09:48,1,0
French beauty products US distribution,2026-01-24 12:09:48,1,0
Australian supplements Shopify US,2026-01-24 12:09:48,1,0
Canadian outdoor gear US expansion,2026-01-24 12:09:48,1,0
Scandinavian furniture online store USA,2026-01-24 12:09:48,1,0
large appliance DTC,2026-01-24 12:35:39,2,0
exercise bikes online store,2026-01-24 12:09:55,1,0
patio sets shopify,2026-01-24 12:25:21,2,0
garden furniture DTC,2026-01-24 12:09:55,1,0
artisan bread direct to consumer,2026-01-24 12:10:01,1,0
microgreens growing kit subscription,2026-01-24 12:10:01,1,0
organic spice blend subscription shopify,2026-01-24 12:10:01,1,0
craft coffee bean subscription online store,2026-01-24 12:10:01,1,0
specialty mushroom growing kit official site,2026-01-24 12:10:01,1,0
fresh pasta subscription delivery USA,2026-01-24 12:10:01,1,0
eco-friendly women's activewear USA online store,2026-01-24 12:10:07,1,0
organic cotton baby clothes shopify store USA,2026-01-24 12:21:59,3,0
recycled swimwear brands online,2026-01-24 12:18:10,3,0
bamboo socks online shop USA,2026-01-24 12:10:07,1,0
plant-based dye clothing company,2026-01-24 12:10:07,1,0
carbon neutral apparel brand,2026-01-24 12:10:07,1,0
eco-friendly packaging clothing brand,2026-01-24 12:11:49,2,0
organic cotton t-shirts DTC brand,2026-01-24 12:30:20,2,0
premium matcha green tea official site,2026-01-24 12:10:15,1,0
gourmet coffee bean online store USA,2026-01-24 12:33:11,3,0
organic spice blend DTC brand,2026-01-24 12:10:15,1,0
luxury candle official site,2026-01-24 12:11:22,2,0
handmade soap online store USA,2026-01-24 12:18:47,2,0
sustainable shampoo bar shopify,2026-01-24 12:10:15,1,0
eco-friendly laundry detergent direct to consumer,2026-01-24 12:29:55,2,0
natural skincare product official site,2026-01-24 12:10:15,1,0
children's wooden toy shopify USA,2026-01-24 12:10:15,1,0
Australian fashion online shop USA,2026-01-24 12:10:22,1,0
Canadian supplements official site US,2026-01-24 12:10:22,1,0
Sustainable baby clothing UK ship to US,2026-01-24 12:10:22,1,0
Ethical jewelry Europe direct to consumer US,2026-01-24 12:10:22,1,0
Handmade leather goods UK US fulfillment,2026-01-24 12:10:22,1,0
Organic tea brand Australia ship to US,2026-01-24 12:10:22,1,0
Artisan coffee beans EU online store USA,2026-01-24 12:10:22,1,0
Gourmet food gifts UK ship to USA,2026-01-24 12:10:22,1,0
electric bike brands USA online,2026-01-24 12:10:28,1,0
freestanding punching bag shopify,2026-01-24 12:10:28,1,0
modern furniture online store,2026-01-24 12:10:28,1,0
heavy duty shelving units DTC,2026-01-24 12:40:36,2,0
adjustable weight bench online store,2026-01-24 12:31:47,2,0
75 inch tv direct to consumer,2026-01-24 12:10:29,1,0
solid wood dining table brands USA,2026-01-24 12:10:29,1,0
inflatable hot tub shopify,2026-01-24 12:14:17,2,0
commercial refrigerator official site,2026-01-24 12:10:29,1,0
exotic fruit subscription box,2026-01-24 12:24:54,3,0
mushroom growing kit subscription box online,2026-01-24 12:10:36,1,0
specialty coffee subscription box USA shopify,2026-01-24 12:10:36,1,0
wine club subscription box online,2026-01-24 12:10:36,1,0
vegan meal kit delivery service official site,2026-01-24 12:10:36,1,0
gluten-free snack box subscription shopify,2026-01-24 12:10:36,1,0
keto snack subscription box DTC,2026-01-24 12:10:36,1,0
paleo meal delivery service,2026-01-24 12:10:36,1,0
sustainable men's underwear DTC,2026-01-24 12:10:43,1,0
organic baby clothes shop USA,2026-01-24 12:10:43,1,0
sustainable kids' clothing boutique,2026-01-24 12:10:43,1,0
eco-friendly workwear direct to consumer,2026-01-24 12:10:43,1,0
organic cotton bedding shopify,2026-01-24 12:26:33,2,0
ethical jewelry brands USA online,2026-01-24 12:10:43,1,0
gourmet food gifts online store USA,2026-01-24 12:36:34,2,0
artisanal skincare shopify plus,2026-01-24 12:10:49,1,0
high-end pet supplies official site,2026-01-24 12:10:49,1,0
luxury stationery direct to consumer,2026-01-24 12:10:49,1,0
premium men's grooming products DTC,2026-01-24 12:10:49,1,0
women's designer shoes official site,2026-01-24 12:10:49,1,0
small batch spirits direct to consumer,2026-01-24 12:30:58,2,0
Australian apparel Shopify US warehouse,2026-01-24 12:10:55,1,0
New Zealand footwear DTC US fulfillment,2026-01-24 12:10:55,1,0
Canadian home goods cross border US,2026-01-24 12:10:55,1,0
European pet supplies ecommerce USA,2026-01-24 12:10:55,1,0
UK supplement brands expanding to US,2026-01-24 12:10:55,1,0
German kitchenware official website US,2026-01-24 12:10:55,1,0
oversized appliance shipping solutions,2026-01-24 12:11:04,1,0
large fitness equipment direct to consumer,2026-01-24 12:39:26,3,0
bulky consumer electronics official site,2026-01-24 12:11:04,1,0
white glove delivery fitness equipment DTC,2026-01-24 12:11:04,1,0
specialized shipping heavy goods USA,2026-01-24 12:11:04,1,0
online retailers large appliances,2026-01-24 12:11:04,1,0
e-commerce furniture delivery challenges,2026-01-24 12:11:04,1,0
high shipping costs fitness brands,2026-01-24 12:11:04,1,0
damaged goods electronics solutions,2026-01-24 12:11:04,1,0
fresh seafood subscription box shopify,2026-01-24 12:11:10,1,0
microgreen growing kit DTC,2026-01-24 12:11:10,1,0
organic coffee bean subscription official site,2026-01-24 12:11:10,1,0
craft beer of the month club direct to consumer,2026-01-24 12:39:33,3,0
heirloom vegetable seed subscription box shopify,2026-01-24 12:11:10,1,0
small batch hot sauce subscription box official site,2026-01-24 12:11:10,1,0
eco-friendly women's clothing online shop USA,2026-01-24 12:11:16,1,0
sustainable denim brand official site,2026-01-24 12:11:16,1,0
ethical activewear shopify store,2026-01-24 12:30:20,2,0
recycled swimwear online shop USA,2026-01-24 12:11:16,1,0
sustainable lingerie brand DTC,2026-01-24 12:11:16,1,0
fair trade clothing online shop USA,2026-01-24 12:11:16,1,0
bamboo clothing direct to consumer,2026-01-24 12:11:16,1,0
artisan chocolate shopify plus,2026-01-24 12:11:22,1,0
high-end tea brands DTC,2026-01-24 12:11:22,1,0
organic baby clothing direct to consumer,2026-01-24 12:32:06,3,0
ethical jewelry shopify plus,2026-01-24 12:11:22,1,0
craft beer official site shop,2026-01-24 12:11:22,1,0
premium pet food direct to consumer USA,2026-01-24 12:11:22,1,0
EU direct to consumer fashion USA,2026-01-24 12:11:30,1,0
Australian outdoor gear US warehouse,2026-01-24 12:11:30,1,0
Canadian baby clothing brand Shopify US,2026-01-24 12:11:30,1,0
German kitchen appliances direct to consumer US,2026-01-24 12:11:30,1,0
Italian leather shoes official site US,2026-01-24 12:11:30,1,0
Spanish gourmet food e-commerce US,2026-01-24 12:11:30,1,0
Scandinavian furniture direct to consumer US,2026-01-24 12:32:45,2,0
oversized sectional online store,2026-01-24 12:11:37,1,0
rattan furniture online shop,2026-01-24 12:11:37,1,0
75 inch tv online store,2026-01-24 12:11:37,1,0
solid wood dining table online shop,2026-01-24 12:11:37,1,0
power rack official site,2026-01-24 12:11:37,1,0
curved sofa direct to consumer,2026-01-24 12:11:37,1,0
sectional sofas online store,2026-01-24 12:37:09,3,0
smart tv official site,2026-01-24 12:11:37,1,0
rare fruit box direct to consumer,2026-01-24 12:11:43,1,0
exotic spice blends online shop,2026-01-24 12:11:43,1,0
cold brew coffee concentrate delivery,2026-01-24 12:11:43,1,0
vinegar subscription box shopify,2026-01-24 12:11:43,1,0
artisan tea subscription online store,2026-01-24 12:11:43,1,0
organic coffee beans delivery USA,2026-01-24 12:11:43,1,0
eco friendly yoga pants online store,2026-01-24 12:28:50,2,0
sustainable swimwear DTC brand,2026-01-24 12:11:49,1,0
recycled material activewear brand,2026-01-24 12:11:49,1,0
carbon neutral shipping apparel company,2026-01-24 12:11:49,1,0
organic cotton t-shirts online store USA,2026-01-24 12:23:58,2,0
sustainable underwear official site,2026-01-24 12:11:49,1,0
artisanal chocolate gifts official site,2026-01-24 12:11:54,1,0
small batch skincare brands shopify,2026-01-24 12:11:54,1,0
organic baby food shopify store USA,2026-01-24 12:11:55,1,0
unique stationery supplies DTC,2026-01-24 12:11:55,1,0
specialty pet food brands shopify,2026-01-24 12:11:55,1,0
craft beer subscription box official site,2026-01-24 12:34:38,2,0
independent bookstore online,2026-01-24 12:11:55,1,0
UK skincare brands expanding to US,2026-01-24 12:25:13,2,0
EU direct to consumer jewelry US shipping,2026-01-24 12:12:01,1,0
Australian apparel official site USA,2026-01-24 12:41:01,3,0
Asia-based electronics DTC US warehouse,2026-01-24 12:12:02,1,0
British shoe brands shipping to US,2026-01-24 12:12:02,1,0
German kitchenware e-commerce USA,2026-01-24 12:12:02,1,0
Canadian outdoor gear brand US,2026-01-24 12:12:02,1,0
Mexican artisanal goods official site US,2026-01-24 12:12:02,1,0
assembled fitness equipment direct to consumer,2026-01-24 12:12:07,1,0
heavy duty shelving units official site,2026-01-24 12:12:07,1,0
oversized garden planters online shop,2026-01-24 12:12:07,1,0
portable basketball hoops for sale,2026-01-24 12:12:07,1,0
ready to assemble kitchen cabinets direct to consumer,2026-01-24 12:12:07,1,0
electronic drum sets online store,2026-01-24 12:24:18,2,0
adjustable height standing desks shopify,2026-01-24 12:12:07,1,0
heavy wooden dining tables official site,2026-01-24 12:12:07,1,0
commercial grade treadmills online,2026-01-24 12:12:07,1,0
gourmet mushroom grow kit subscription box,2026-01-24 12:12:13,1,0
microgreen subscription box direct to consumer,2026-01-24 12:31:54,2,0
specialty coffee bean subscription box official site,2026-01-24 12:12:13,1,0
rare fruit subscription box USA,2026-01-24 12:12:13,1,0
exotic plant subscription box Shopify,2026-01-24 12:12:13,1,0
fresh seafood subscription box delivery,2026-01-24 12:12:13,1,0
vegan meal prep subscription box nationwide,2026-01-24 12:12:13,1,0
organic spice subscription box,2026-01-24 12:12:13,1,0
eco-friendly activewear brand USA official site,2026-01-24 12:12:19,1,0
sustainable linen clothing online store,2026-01-24 12:12:19,1,0
recycled swimwear direct to consumer,2026-01-24 12:12:19,1,0
ethical jewelry brand official website,2026-01-24 12:12:19,1,0
vegan leather handbags online shop USA,2026-01-24 12:26:03,2,0
fair trade t-shirts DTC,2026-01-24 12:12:19,1,0
eco-conscious outerwear official site,2026-01-24 12:12:19,1,0
high-end skincare direct to consumer,2026-01-24 12:36:27,2,0
premium pet food official site,2026-01-24 12:12:25,1,0
luxury scented candles shopify,2026-01-24 12:28:55,2,0
gourmet food gift baskets online shop,2026-01-24 12:12:26,1,0
organic baby clothing dtc brand,2026-01-24 12:12:26,1,0
specialty tea online store USA,2026-01-24 12:18:16,3,0
personalized stationery direct to consumer,2026-01-24 12:40:55,3,0
French linen bedding shopify USA,2026-01-24 12:23:14,3,0
Japanese kitchen knife official site USA,2026-01-24 12:12:35,1,0
Italian leather shoe DTC USA,2026-01-24 12:12:35,1,0
Spanish olive oil brand USA,2026-01-24 12:12:35,1,0
Canadian outdoor apparel store USA,2026-01-24 12:12:35,1,0
Swiss watch direct to consumer USA,2026-01-24 12:12:35,1,0
exercise equipment official site USA,2026-01-24 12:12:41,1,0
oversized electronics shopify store,2026-01-24 12:12:41,1,0
sectional sofa online shop,2026-01-24 12:15:52,3,0
treadmill for home DTC,2026-01-24 12:12:41,1,0
commercial refrigerator online retailer,2026-01-24 12:12:41,1,0
large screen tv official website,2026-01-24 12:12:41,1,0
rustic furniture online shop USA,2026-01-24 12:12:41,1,0
outdoor fitness equipment online store,2026-01-24 12:12:41,1,0
artisan cheese monthly club online store,2026-01-24 12:12:46,1,0
rare succulent subscription box DTC,2026-01-24 12:12:46,1,0
microgreen grow kit delivery,2026-01-24 12:12:46,1,0
exotic fruit of the month club,2026-01-24 12:12:46,1,0
edible flower garden kit delivery,2026-01-24 12:12:46,1,0
craft chocolate subscription box USA,2026-01-24 12:12:46,1,0
organic baby clothes official site USA,2026-01-24 12:32:00,3,0
ethical lingerie shopify,2026-01-24 12:32:30,2,0
bamboo socks DTC brand,2026-01-24 12:38:25,2,0
fair trade t shirts official website,2026-01-24 12:12:52,1,0
vegan leather handbags online store USA,2026-01-24 12:27:39,2,0
organic cotton bedding direct to consumer,2026-01-24 12:12:53,1,0
eco friendly outdoor clothing brands,2026-01-24 12:12:53,1,0
recycled plastic sunglasses official site,2026-01-24 12:18:10,3,0
sustainable jewelry brands online,2026-01-24 12:12:53,1,0
artisan tea subscription box official site,2026-01-24 12:12:58,1,0
small batch skincare products DTC,2026-01-24 12:12:58,1,0
handcrafted jewelry online shop USA,2026-01-24 12:12:58,1,0
specialty food gifts online store,2026-01-24 12:24:04,2,0
natural pet food online store USA,2026-01-24 12:12:58,1,0
luxury bath and body products DTC,2026-01-24 12:17:44,3,0
UK skincare brand US expansion,2026-01-24 12:13:07,1,0
EU fashion brand official site USA,2026-01-24 12:13:07,1,0
Australian homeware online store US,2026-01-24 12:13:07,1,0
German kitchen gadget D2C USA,2026-01-24 12:13:07,1,0
Japanese beauty product online shop US,2026-01-24 12:13:07,1,0
Korean cosmetic brand US distributor,2026-01-24 12:13:07,1,0
Nordic furniture US online store,2026-01-24 12:13:07,1,0
Swiss watch US ecommerce,2026-01-24 12:13:07,1,0
electric bicycle DTC brand,2026-01-24 12:13:12,1,0
wooden baby furniture online shop,2026-01-24 12:13:12,1,0
portable basketball hoop official website,2026-01-24 12:13:13,1,0
soundbar system direct to consumer,2026-01-24 12:13:13,1,0
king size mattress in a box online,2026-01-24 12:35:05,2,0
outdoor patio furniture sets shopify,2026-01-24 12:13:13,1,0
gaming monitor direct to consumer brand,2026-01-24 12:13:13,1,0
solid wood dining table online store,2026-01-24 12:17:25,2,0
gourmet mushroom growing kit shopify,2026-01-24 12:20:14,2,0
exotic fruit subscription box official site,2026-01-24 12:23:53,3,0
cold brew coffee subscription service USA,2026-01-24 12:13:19,1,0
small batch spice blends direct to consumer,2026-01-24 12:13:19,1,0
organic tea sampler subscription box,2026-01-24 12:40:06,3,0
vegan cheese subscription box shopify,2026-01-24 12:37:51,2,0
eco friendly baby clothes online store USA,2026-01-24 12:13:24,1,0
ethical swimwear brands shopify,2026-01-24 12:13:25,1,0
eco conscious activewear brands USA,2026-01-24 12:13:25,1,0
organic linen dresses direct to consumer,2026-01-24 12:33:34,3,0
sustainable sleepwear brands shopify,2026-01-24 12:13:25,1,0
eco friendly kids clothing official site,2026-01-24 12:13:25,1,0
organic baby blankets online shop,2026-01-24 12:13:25,1,0
ethical lingerie brands USA,2026-01-24 12:13:25,1,0
sustainable maternity clothes direct to consumer,2026-01-24 12:30:52,2,0
premium artisanal coffee beans online store,2026-01-24 12:13:31,1,0
luxury scented candles direct to consumer USA,2026-01-24 12:13:31,1,0
organic baby formula official site,2026-01-24 12:13:31,1,0
high-end skincare products DTC brands,2026-01-24 12:13:31,1,0
gourmet food baskets online shop,2026-01-24 12:13:31,1,0
unique home decor items official site,2026-01-24 12:13:32,1,0
eco-friendly cleaning supplies DTC brands,2026-01-24 12:13:32,1,0
UK beauty products US fulfillment,2026-01-24 12:13:37,1,0
EU fashion brand US distribution,2026-01-24 12:13:37,1,0
APAC electronics online store US warehouse,2026-01-24 12:13:37,1,0
Australian supplements official site USA,2026-01-24 12:13:37,1,0
French linen bedding US store,2026-01-24 12:13:37,1,0
Italian leather shoes US fulfillment center,2026-01-24 12:13:37,1,0
Spanish olive oil online shop US,2026-01-24 12:13:37,1,0
oversized appliance online retailer,2026-01-24 12:13:42,1,0
large screen TV direct to consumer,2026-01-24 12:29:07,3,0
king size mattress brands direct,2026-01-24 12:13:42,1,0
residential safe delivery service online,2026-01-24 12:13:42,1,0
outdoor playset online retailer,2026-01-24 12:13:42,1,0
electric bicycle brands direct to consumer,2026-01-24 12:13:42,1,0
standing desk converter official site,2026-01-24 12:13:42,1,0
ergonomic office chair shopify store,2026-01-24 12:13:42,1,0
large format printer delivery USA,2026-01-24 12:13:42,1,0
artisan bread delivery service online,2026-01-24 12:30:43,3,0
gourmet cookie dough subscription DTC,2026-01-24 12:13:49,1,0
fresh pasta online store nationwide,2026-01-24 12:13:49,1,0
exotic fruit delivery service online store,2026-01-24 12:31:54,2,0
microgreen subscription box DTC,2026-01-24 12:13:49,1,0
mushroom growing kit subscription Shopify,2026-01-24 12:36:47,2,0
fermented foods subscription box DTC,2026-01-24 12:13:49,1,0
organic spice subscription Shopify,2026-01-24 12:13:49,1,0
eco-conscious outerwear shopify,2026-01-24 12:35:20,2,0
ethical cashmere sweaters online store,2026-01-24 12:13:54,1,0
sustainable jewelry brands USA,2026-01-24 12:13:54,1,0
premium tea subscription box USA,2026-01-24 12:41:27,2,0
luxury skincare shopify plus,2026-01-24 12:14:00,1,0
high-end men's grooming products DTC,2026-01-24 12:30:26,2,0
sustainable baby clothing online shop,2026-01-24 12:14:00,1,0
organic cotton bedding official site,2026-01-24 12:19:16,2,0
craft beer of the month club,2026-01-24 12:15:57,2,0
specialty food gifts USA,2026-01-24 12:14:00,1,0
plant-based protein powder direct to consumer,2026-01-24 12:14:00,1,0
eco-friendly cleaning supplies online,2026-01-24 12:40:54,2,0
MENA dates online store US delivery,2026-01-24 12:14:11,1,0
APAC beauty products US warehouse,2026-01-24 12:14:11,1,0
Australian outdoor gear official site USA,2026-01-24 12:24:42,3,0
British tea brands US online shop,2026-01-24 12:14:11,1,0
French linen bedding US direct,2026-01-24 12:14:11,1,0
Spanish olive oil online store US,2026-01-24 12:14:11,1,0
Scandinavian furniture US official site,2026-01-24 12:14:11,1,0
sectional sofa online store USA,2026-01-24 12:14:17,1,0
electric bicycle shopify brands,2026-01-24 12:14:17,1,0
heavy duty shelving units online shop,2026-01-24 12:14:17,1,0
freestanding bathtub official website,2026-01-24 12:14:17,1,0
adjustable bed frame online store,2026-01-24 12:19:39,2,0
power tool combo kit official site,2026-01-24 12:14:17,1,0
outdoor furniture sets direct to consumer,2026-01-24 12:14:17,1,0
exotic fruit box monthly subscription,2026-01-24 12:14:26,1,0
organic vegetable seeds subscription box,2026-01-24 12:14:26,1,0
rare plant subscription box USA Shopify,2026-01-24 12:29:14,2,0
microgreens subscription box,2026-01-24 12:14:26,1,0
specialty coffee bean subscription,2026-01-24 12:14:26,1,0
artisan chocolate subscription online,2026-01-24 12:14:26,1,0
recycled plastic activewear official site,2026-01-24 12:14:32,1,0
fair trade cotton t-shirts USA,2026-01-24 12:14:32,1,0
eco-friendly sleepwear official site,2026-01-24 12:14:32,1,0
recycled wool sweaters direct to consumer,2026-01-24 12:14:32,1,0
handcrafted jewelry official site USA,2026-01-24 12:38:03,2,0
organic skincare DTC brand,2026-01-24 12:14:38,1,0
sustainable baby clothing online shop USA,2026-01-24 12:14:38,1,0
eco-friendly home goods shopify store,2026-01-24 12:14:38,1,0
luxury bedding direct to consumer brand,2026-01-24 12:14:38,1,0
high-end stationery official website,2026-01-24 12:14:38,1,0
small batch sauces DTC,2026-01-24 12:14:38,1,0
natural pet food official site,2026-01-24 12:14:38,1,0
EU sustainable footwear online store USA,2026-01-24 12:14:44,1,0
Australian organic skincare brands US warehouse,2026-01-24 12:14:44,1,0
Canadian pet supply store US fulfillment,2026-01-24 12:14:44,1,0
European cycling apparel online shop USA,2026-01-24 12:14:44,1,0
German kitchenware shopify store USA,2026-01-24 12:14:44,1,0
French children's clothing online store US,2026-01-24 12:14:44,1,0
oversized electronics official site,2026-01-24 12:30:08,2,0
furniture delivery companies shopify,2026-01-24 12:14:50,1,0
home gym equipment online store usa,2026-01-24 12:14:50,1,0
large screen tvs direct to consumer,2026-01-24 12:18:29,2,0
high end speaker systems official site,2026-01-24 12:14:50,1,0
king size mattresses online store usa,2026-01-24 12:14:50,1,0
power racks direct to consumer,2026-01-24 12:14:50,1,0
75 inch tv online retailer,2026-01-24 12:35:04,2,0
monthly cheese subscription box online,2026-01-24 12:14:55,1,0
artisan chocolate delivery service DTC,2026-01-24 12:14:55,1,0
gourmet olive oil online store,2026-01-24 12:25:06,2,0
microgreens subscription box online,2026-01-24 12:14:55,1,0
organic spice blend direct to consumer,2026-01-24 12:14:55,1,0
rare tea subscription box USA,2026-01-24 12:14:55,1,0
sourdough bread baking kit online store,2026-01-24 12:14:55,1,0
organic baby clothing brands USA Shopify,2026-01-24 12:15:00,1,0
bamboo socks online store USA,2026-01-24 12:15:00,1,0
fair trade t-shirts official site,2026-01-24 12:28:16,2,0
eco-conscious outerwear online store,2026-01-24 12:15:00,1,0
organic cotton dresses direct to consumer,2026-01-24 12:15:01,1,0
ethical jewelry online shop USA,2026-01-24 12:15:01,1,0
recycled plastic shoes DTC,2026-01-24 12:15:01,1,0
luxury bedding sets online store,2026-01-24 12:15:09,1,0
organic baby clothing official site USA,2026-01-24 12:15:09,1,0
sustainable yoga mats shopify,2026-01-24 12:15:09,1,0
gourmet coffee beans DTC brand,2026-01-24 12:15:09,1,0
handmade leather goods direct to consumer,2026-01-24 12:26:09,2,0
natural skincare products official site USA,2026-01-24 12:15:09,1,0
high-end pet supplies DTC,2026-01-24 12:15:09,1,0
