keyword,last_used,times_used,companies_found
commercial refrigerator online store,2026-01-24 12:28:03,1,0
heavy duty shelving direct to consumer,2026-01-24 12:28:03,1,0
industrial workbench shopify,2026-01-24 12:28:03,1,0
steel storage cabinet online store,2026-01-24 12:28:03,1,0
home theater seating shopify,2026-01-24 12:28:03,1,0
king size mattress DTC,2026-01-24 12:28:03,1,0
fresh pasta subscription DTC,2026-01-24 12:31:54,3,0
organic baby food subscription box direct to consumer,2026-01-24 12:28:10,1,0
spicy sauce subscription DTC,2026-01-24 12:28:10,1,0
vegan meal kit delivery USA,2026-01-24 12:28:10,1,0
raw honey subscription box online store,2026-01-24 12:31:54,2,0
gourmet mushroom growing kit official site,2026-01-24 12:28:10,1,0
air plant subscription box direct to consumer,2026-01-24 12:34:07,3,0
ethical men's fashion DTC brand,2026-01-24 12:28:15,1,0
biodegradable packaging apparel online,2026-01-24 12:39:39,2,0
carbon neutral shipping clothing brand,2026-01-24 12:39:39,3,0
eco-conscious lingerie direct to consumer,2026-01-24 12:28:16,1,0
sustainable children's clothing shopify,2026-01-24 12:28:16,1,0
eco-friendly maternity wear DTC brand,2026-01-24 12:28:16,1,0
organic linen dresses online store,2026-01-24 12:28:16,1,0
recycled plastic shoes official site,2026-01-24 12:38:26,2,0
high-end coffee beans online store,2026-01-24 12:28:21,1,0
gourmet spice blends DTC,2026-01-24 12:29:25,2,0
artisan candle brands USA Shopify,2026-01-24 12:28:21,1,0
luxury bath and body products direct to consumer,2026-01-24 12:28:21,1,0
craft beer brewing kits official site,2026-01-24 12:28:21,1,0
unique home decor items DTC,2026-01-24 12:28:21,1,0
vegan protein powder online shop,2026-01-24 12:28:21,1,0
UK baby clothing US distribution,2026-01-24 12:28:28,1,0
EU organic skincare US fulfillment,2026-01-24 12:28:28,1,0
MENA dates online shop USA,2026-01-24 12:28:28,1,0
APAC electronics direct to consumer US warehouse,2026-01-24 12:28:28,1,0
Australian swimwear Shopify US,2026-01-24 12:28:28,1,0
New Zealand manuka honey US storefront,2026-01-24 12:28:28,1,0
Canadian outdoor gear DTC US,2026-01-24 12:28:28,1,0
British tea official site US,2026-01-24 12:28:28,1,0
German auto parts online store US,2026-01-24 12:28:28,1,0
French luxury goods US expansion,2026-01-24 12:28:28,1,0
sectional sofas shippable DTC,2026-01-24 12:28:37,1,0
treadmills online shop USA,2026-01-24 12:28:37,1,0
weightlifting equipment online store,2026-01-24 12:28:37,1,0
home gym equipment Shopify,2026-01-24 12:28:37,1,0
patio sets official site,2026-01-24 12:28:37,1,0
gaming computers shippable DTC,2026-01-24 12:28:38,1,0
gourmet cheese subscription box USA direct to consumer,2026-01-24 12:33:00,3,0
fresh pasta delivery subscription online store,2026-01-24 12:28:43,1,0
artisan bread subscription box shippable,2026-01-24 12:28:43,1,0
organic spice subscription box DTC,2026-01-24 12:28:43,1,0
microgreens subscription box Shopify,2026-01-24 12:28:43,1,0
succulent subscription box online store,2026-01-24 12:34:07,2,0
exotic fruit subscription box shippable,2026-01-24 12:28:43,1,0
craft beer subscription box USA Shopify,2026-01-24 12:28:43,1,0
sustainable linen clothing brand usa,2026-01-24 12:28:50,1,0
biodegradable packaging apparel official site,2026-01-24 12:28:50,1,0
sustainable swimwear online shop,2026-01-24 12:28:50,1,0
eco friendly shoe brand direct to consumer,2026-01-24 12:28:50,1,0
organic baby blankets usa official site,2026-01-24 12:28:50,1,0
recycled material clothing shopify,2026-01-24 12:28:50,1,0
sustainable denim brand usa,2026-01-24 12:28:50,1,0
sustainable home goods ecommerce brands,2026-01-24 12:28:55,1,0
organic baby food DTC official site,2026-01-24 12:28:55,1,0
small batch sauces and condiments DTC,2026-01-24 12:28:55,1,0
craft beer online store official site,2026-01-24 12:28:55,1,0
plant-based protein powder shopify,2026-01-24 12:28:55,1,0
gluten-free snacks ecommerce,2026-01-24 12:28:55,1,0
organic pet supplies direct to consumer USA,2026-01-24 12:28:55,1,0
sustainable fashion accessories online store,2026-01-24 12:28:55,1,0
European cosmetics brand US distribution,2026-01-24 12:29:02,1,0
Australian supplements direct to consumer USA,2026-01-24 12:29:02,1,0
MENA skincare brand US fulfillment,2026-01-24 12:29:02,1,0
French linen online store USA,2026-01-24 12:29:02,1,0
Spanish shoes shopify US warehouse,2026-01-24 12:29:02,1,0
Nordic furniture brand US expansion,2026-01-24 12:29:02,1,0
Swiss watches online store USA,2026-01-24 12:29:02,1,0
oversized appliance delivery service brands,2026-01-24 12:29:07,1,0
sectional sofas shopify stores,2026-01-24 12:29:07,1,0
dining table set DTC brands,2026-01-24 12:29:07,1,0
outdoor patio furniture online retailers,2026-01-24 12:29:07,1,0
weightlifting equipment official site USA,2026-01-24 12:29:07,1,0
adjustable beds direct to consumer brands,2026-01-24 12:29:07,1,0
electric fireplaces online shop,2026-01-24 12:29:07,1,0
specialty coffee bean subscription shippable,2026-01-24 12:29:14,1,0
fresh seafood delivery subscription Shopify,2026-01-24 12:29:14,1,0
organic fruit basket delivery DTC,2026-01-24 12:29:14,1,0
exotic mushroom growing kit online shop,2026-01-24 12:29:14,1,0
bonsai tree subscription box official site,2026-01-24 12:29:14,1,0
air plant subscription box shippable,2026-01-24 12:29:14,1,0
hydroponic herb garden kit online store,2026-01-24 12:29:14,1,0
ethical denim jeans official site,2026-01-24 12:29:20,1,0
bamboo clothing online shop,2026-01-24 12:29:20,1,0
sustainable workwear for women shopify,2026-01-24 12:29:20,1,0
eco-friendly maternity clothing online,2026-01-24 12:29:21,1,0
sustainable men's underwear shopify,2026-01-24 12:29:21,1,0
ethical socks direct to consumer,2026-01-24 12:29:21,1,0
premium olive oil online shop,2026-01-24 12:29:25,1,0
sustainable skincare shopify plus,2026-01-24 12:29:25,1,0
natural hair care DTC brand,2026-01-24 12:29:25,1,0
organic baby clothes online store,2026-01-24 12:29:25,1,0
children's wooden toys shopify,2026-01-24 12:29:25,1,0
educational games DTC,2026-01-24 12:29:25,1,0
EU sustainable fashion US online store,2026-01-24 12:29:33,1,0
New Zealand outdoor gear US storefront,2026-01-24 12:29:33,1,0
Canadian pet supplies DTC USA,2026-01-24 12:29:33,1,0
German kitchenware online store US,2026-01-24 12:29:33,1,0
French luxury goods US shipping,2026-01-24 12:29:33,1,0
Spanish footwear online shop US,2026-01-24 12:29:33,1,0
Swedish home goods US online store,2026-01-24 12:29:33,1,0
oversized sectional sofas online shop,2026-01-24 12:29:39,1,0
prefabricated shed kits online store,2026-01-24 12:29:39,1,0
weighted blanket DTC brand,2026-01-24 12:29:39,1,0
ergonomic office chairs shopify,2026-01-24 12:29:39,1,0
electric scooters DTC brand,2026-01-24 12:29:39,1,0
inflatable hot tubs online shop,2026-01-24 12:29:39,1,0
large dog crates direct to consumer,2026-01-24 12:29:39,1,0
craft chocolate monthly club direct to consumer,2026-01-24 12:29:44,1,0
fresh pasta subscription direct to consumer,2026-01-24 12:29:45,1,0
small batch coffee roasters online store subscription,2026-01-24 12:29:45,1,0
organic spice blends subscription box,2026-01-24 12:29:45,1,0
heirloom vegetable seed subscription shopify,2026-01-24 12:29:45,1,0
farm-fresh egg delivery subscription DTC,2026-01-24 12:29:45,1,0
specialty olive oil subscription box official site,2026-01-24 12:29:45,1,0
eco friendly yoga apparel online store USA,2026-01-24 12:29:49,1,0
ethical women's clothing shopify,2026-01-24 12:29:49,1,0
carbon neutral shipping fashion brand USA,2026-01-24 12:29:49,1,0
recycled material clothing online store,2026-01-24 12:29:49,1,0
sustainable activewear DTC,2026-01-24 12:29:49,1,0
eco friendly lingerie brands USA,2026-01-24 12:35:51,2,0
ethical men's clothing shopify,2026-01-24 12:29:49,1,0
sustainable denim brands direct to consumer USA,2026-01-24 12:29:50,1,0
eco conscious footwear online store,2026-01-24 12:29:50,1,0
premium matcha powder direct to consumer,2026-01-24 12:36:27,2,0
high-end coffee subscription box official site,2026-01-24 12:29:55,1,0
artisanal olive oil shopify store USA,2026-01-24 12:29:55,1,0
gourmet spice blends online shop,2026-01-24 12:29:55,1,0
luxury tea blends direct to consumer brand,2026-01-24 12:29:55,1,0
specialty hot sauce official site,2026-01-24 12:29:55,1,0
small batch chocolate bars online store,2026-01-24 12:29:55,1,0
craft cocktail mixers shopify,2026-01-24 12:29:55,1,0
sustainable home cleaning supplies USA,2026-01-24 12:29:55,1,0
uk fashion brands shipping to us,2026-01-24 12:30:01,1,0
australian skincare direct to consumer usa,2026-01-24 12:30:01,1,0
german kitchenware official site usa,2026-01-24 12:30:02,1,0
french linen bedding shopify usa,2026-01-24 12:30:02,1,0
italian leather shoes online store usa,2026-01-24 12:30:02,1,0
spanish olive oil d2c usa,2026-01-24 12:30:02,1,0
swedish minimalist furniture online shop usa,2026-01-24 12:30:02,1,0
danish modern lighting us website,2026-01-24 12:30:02,1,0
swiss watches direct to consumer usa,2026-01-24 12:30:02,1,0
japanese ceramics shopify store usa,2026-01-24 12:30:02,1,0
heavy furniture delivery USA,2026-01-24 12:30:08,1,0
bulk fitness equipment DTC,2026-01-24 12:30:08,1,0
white glove delivery consumer electronics,2026-01-24 12:30:08,1,0
in home delivery fitness equipment,2026-01-24 12:30:08,1,0
extra large item shipping,2026-01-24 12:30:08,1,0
unboxed furniture delivery,2026-01-24 12:30:09,1,0
assembled fitness equipment shipping,2026-01-24 12:30:09,1,0
specialty coffee bean subscription box Shopify,2026-01-24 12:30:14,1,0
microgreen growing kit for beginners USA,2026-01-24 12:30:14,1,0
sourdough starter kit subscription box,2026-01-24 12:30:15,1,0
heirloom vegetable seed box delivery,2026-01-24 12:30:15,1,0
fresh pasta subscription service DTC,2026-01-24 12:30:15,1,0
organic tea sampler box online store,2026-01-24 12:30:15,1,0
edible flower growing kit subscription,2026-01-24 12:30:15,1,0
regional honey variety pack direct to consumer,2026-01-24 12:30:15,1,0
eco-friendly women's clothing online shop,2026-01-24 12:30:20,1,0
fair trade denim jeans USA shop,2026-01-24 12:30:20,1,0
sustainable workwear official site,2026-01-24 12:30:20,1,0
ethical cashmere sweaters online,2026-01-24 12:30:20,1,0
artisan chocolate online store,2026-01-24 12:30:26,1,0
sustainable home goods Shopify,2026-01-24 12:30:26,1,0
organic baby food DTC brand,2026-01-24 12:30:26,1,0
luxury candles official website,2026-01-24 12:30:26,1,0
natural pet food online store,2026-01-24 12:30:26,1,0
specialty tea Shopify,2026-01-24 12:30:26,1,0
UK beauty brands shipping to USA online store,2026-01-24 12:30:31,1,0
Australian swimwear DTC USA official site,2026-01-24 12:30:31,1,0
European shoe brands direct to consumer USA,2026-01-24 12:30:31,1,0
handmade jewelry online store US shipping,2026-01-24 12:30:31,1,0
artisan coffee beans USA direct from roaster,2026-01-24 12:30:31,1,0
gourmet food gifts USA online shop,2026-01-24 12:30:31,1,0
sustainable fashion brands USA direct,2026-01-24 12:30:31,1,0
organic skincare brands USA online shop,2026-01-24 12:30:31,1,0
natural pet supplies DTC USA,2026-01-24 12:30:31,1,0
luxury home decor online store USA,2026-01-24 12:30:31,1,0
heavy furniture delivery USA direct to consumer,2026-01-24 12:30:37,1,0
large screen tv shipping official site,2026-01-24 12:35:04,2,0
sectional sofa brands online,2026-01-24 12:30:37,1,0
85 inch tv direct to consumer,2026-01-24 12:30:37,1,0
weightlifting equipment brands USA,2026-01-24 12:35:39,2,0
electric bicycle official site,2026-01-24 12:30:38,1,0
pool table delivery direct to consumer,2026-01-24 12:30:38,1,0
microgreens growing kit online store,2026-01-24 12:39:33,2,0
air purifying plant delivery online,2026-01-24 12:30:44,1,0
succulent subscription box USA shopify,2026-01-24 12:30:44,1,0
live herb plant delivery service DTC,2026-01-24 12:30:44,1,0
cold brew coffee subscription online,2026-01-24 12:30:44,1,0
organic baby clothes shopify brands USA,2026-01-24 12:30:52,1,0
recycled fabric activewear brands online,2026-01-24 12:30:52,1,0
fair trade clothing online store USA,2026-01-24 12:30:52,1,0
sustainable denim direct to consumer brands,2026-01-24 12:30:52,1,0
eco-friendly lingerie online shop,2026-01-24 12:30:52,1,0
sustainable sleepwear direct to consumer USA,2026-01-24 12:30:52,1,0
recycled plastic swimwear brands online store,2026-01-24 12:30:52,1,0
ethical workwear for women official site,2026-01-24 12:30:52,1,0
organic skincare direct to consumer USA,2026-01-24 12:30:58,1,0
sustainable fashion dtc brand,2026-01-24 12:30:58,1,0
unique home decor official site,2026-01-24 12:30:58,1,0
specialty tea shopify plus,2026-01-24 12:30:58,1,0
UK skincare brands US distribution,2026-01-24 12:31:08,1,0
EU footwear direct to consumer US,2026-01-24 12:31:08,1,0
Canadian home decor online store US,2026-01-24 12:31:08,1,0
Korean fashion DTC USA,2026-01-24 12:31:08,1,0
German kitchenware brands US warehouse,2026-01-24 12:31:08,1,0
oversized bean bag chairs online store,2026-01-24 12:41:40,2,0
assembled home gym equipment official site,2026-01-24 12:31:15,1,0
large format 3D printers DTC,2026-01-24 12:31:15,1,0
portable basketball hoops direct to consumer,2026-01-24 12:31:15,1,0
electric scooter online store official,2026-01-24 12:31:15,1,0
sectional sofas with free shipping USA,2026-01-24 12:31:15,1,0
weightlifting benches online store,2026-01-24 12:31:15,1,0
curved gaming monitors official site,2026-01-24 12:31:15,1,0
solid wood dining tables Shopify,2026-01-24 12:31:15,1,0
fresh pasta delivery service direct to consumer,2026-01-24 12:31:21,1,0
organic fruit delivery service shopify,2026-01-24 12:31:21,1,0
exotic fruit subscription box DTC,2026-01-24 12:33:00,2,0
raw honey subscription box direct to consumer,2026-01-24 12:31:21,1,0
small batch ice cream delivery service,2026-01-24 12:31:21,1,0
farm fresh egg delivery service USA,2026-01-24 12:31:21,1,0
heirloom seed subscription box online store,2026-01-24 12:31:21,1,0
organic baby clothing DTC brands,2026-01-24 12:31:26,1,0
recycled denim jeans shopify store,2026-01-24 12:31:26,1,0
fair trade t-shirts direct to consumer,2026-01-24 12:31:26,1,0
eco-conscious outdoor gear brands USA,2026-01-24 12:31:26,1,0
organic cotton underwear online shop,2026-01-24 12:31:26,1,0
high-end candle online store USA,2026-01-24 12:31:34,1,0
premium skincare brands official site,2026-01-24 12:31:34,1,0
luxury stationery online shop,2026-01-24 12:31:34,1,0
sustainable jewelry brand USA Shopify,2026-01-24 12:31:35,1,0
ethical home goods direct to consumer,2026-01-24 12:31:35,1,0
boutique pet supplies online shop,2026-01-24 12:31:35,1,0
specialty food products DTC,2026-01-24 12:31:35,1,0
handmade soaps official site,2026-01-24 12:31:35,1,0
unique home decor direct to consumer,2026-01-24 12:31:35,1,0
European baby formula online store USA,2026-01-24 12:31:41,1,0
ethical fashion brands EU shipping US,2026-01-24 12:31:41,1,0
artisan coffee beans online shop USA,2026-01-24 12:31:41,1,0
premium tea brands UK official website US,2026-01-24 12:31:41,1,0
natural cosmetics direct to consumer US,2026-01-24 12:31:41,1,0
sustainable homeware brands UK ship US,2026-01-24 12:31:41,1,0
gourmet food gifts online store Europe US,2026-01-24 12:31:41,1,0
organic baby clothing Shopify USA,2026-01-24 12:31:41,1,0
oversized sectional couch online store,2026-01-24 12:31:47,1,0
heavy electric bicycle direct to consumer,2026-01-24 12:31:47,1,0
portable home gym equipment official site,2026-01-24 12:31:47,1,0
rattan furniture shopify USA,2026-01-24 12:31:47,1,0
assembled treadmill direct to consumer,2026-01-24 12:31:47,1,0
outdoor patio set ecommerce,2026-01-24 12:31:47,1,0
inflatable hot tub online shop,2026-01-24 12:31:47,1,0
vegan meal kit delivery service shopify,2026-01-24 12:31:54,1,0
sourdough starter subscription box online,2026-01-24 12:31:54,1,0
heirloom tomato seeds subscription box USA,2026-01-24 12:31:54,1,0
sustainable linen clothing DTC,2026-01-24 12:32:00,1,0
recycled material activewear shopify,2026-01-24 12:32:00,1,0
ethical denim brands online store,2026-01-24 12:32:00,1,0
carbon neutral shipping apparel,2026-01-24 12:32:00,1,0
eco-conscious accessories official site,2026-01-24 12:32:00,1,0
organic cotton socks shopify,2026-01-24 12:32:00,1,0
recycled polyester outerwear DTC,2026-01-24 12:32:00,1,0
ethical jewelry DTC brands USA,2026-01-24 12:32:06,1,0
premium skincare online store,2026-01-24 12:32:06,1,0
gourmet coffee beans official site,2026-01-24 12:32:06,1,0
artisan chocolate DTC brands,2026-01-24 12:32:06,1,0
small batch sauces direct to consumer,2026-01-24 12:32:06,1,0
personalized stationery DTC brands USA,2026-01-24 12:32:06,1,0
handmade ceramics shopify,2026-01-24 12:32:06,1,0
EU sustainable footwear direct to consumer,2026-01-24 12:32:12,1,0
Australian pet supply brands US warehouse,2026-01-24 12:32:12,1,0
Canadian artisan food shopify US,2026-01-24 12:32:12,1,0
European organic tea online shop USA,2026-01-24 12:32:12,1,0
UK cycling apparel official site US,2026-01-24 12:32:12,1,0
EU luxury cosmetics direct to consumer USA,2026-01-24 12:32:12,1,0
Middle Eastern date suppliers US online,2026-01-24 12:32:12,1,0
large screen TVs direct to consumer,2026-01-24 12:32:18,1,0
solid wood bed frames shopify,2026-01-24 12:32:18,1,0
outdoor speakers official site,2026-01-24 12:32:18,1,0
rustic dining tables online store,2026-01-24 12:32:18,1,0
curved TVs official website,2026-01-24 12:32:18,1,0
craft cheese of the month club shopify,2026-01-24 12:32:25,1,0
heirloom vegetable seed collection online shop,2026-01-24 12:32:25,1,0
regional olive oil tasting subscription,2026-01-24 12:32:25,1,0
gourmet hot sauce subscription box USA,2026-01-24 12:32:25,1,0
artisan chocolate monthly subscription official site,2026-01-24 12:32:25,1,0
sustainable swimwear official site USA,2026-01-24 12:34:12,2,0
organic baby clothes DTC brand,2026-01-24 12:32:30,1,0
fair trade knitwear online store,2026-01-24 12:32:30,1,0
sustainable activewear brand USA,2026-01-24 12:32:30,1,0
eco-conscious maternity wear shopify,2026-01-24 12:32:30,1,0
recycled polyester dresses DTC,2026-01-24 12:32:30,1,0
sustainable socks online store USA,2026-01-24 12:32:30,1,0
ethical men's clothing brands shopify,2026-01-24 12:32:30,1,0
eco-friendly kids clothes online store,2026-01-24 12:32:30,1,0
premium matcha powder online store,2026-01-24 12:32:38,1,0
artisanal olive oil direct to consumer USA,2026-01-24 12:32:38,1,0
gourmet coffee beans shopify,2026-01-24 12:32:38,1,0
organic spice blends dtc,2026-01-24 12:32:38,1,0
luxury scented candles online shop,2026-01-24 12:32:38,1,0
handcrafted ceramic mugs direct to consumer,2026-01-24 12:32:38,1,0
natural skincare products direct to consumer USA,2026-01-24 12:32:38,1,0
organic baby clothing brands shopify plus,2026-01-24 12:32:38,1,0
ethical fashion accessories online store,2026-01-24 12:32:38,1,0
EU direct to consumer coffee roasters US warehouse,2026-01-24 12:32:45,1,0
MENA beauty products Shopify US fulfillment,2026-01-24 12:32:45,1,0
British heritage clothing DTC USA,2026-01-24 12:32:45,1,0
German kitchenware online shop US delivery,2026-01-24 12:32:45,1,0
French artisan jewelry official website USA,2026-01-24 12:32:45,1,0
Japanese stationery online store USA shipping,2026-01-24 12:32:45,1,0
Korean beauty products Shopify US warehouse,2026-01-24 12:32:45,1,0
outdoor furniture direct to consumer brands,2026-01-24 12:32:53,1,0
large screen tv shopify,2026-01-24 12:32:53,1,0
custom cabinet online store,2026-01-24 12:32:53,1,0
electric bikes shopify,2026-01-24 12:32:53,1,0
mattress in a box official site,2026-01-24 12:32:53,1,0
garden sheds direct to consumer,2026-01-24 12:32:53,1,0
pool tables shopify store,2026-01-24 12:32:53,1,0
home saunas official site,2026-01-24 12:32:53,1,0
fresh seafood delivery subscription,2026-01-24 12:33:00,1,0
organic baby food subscription box USA,2026-01-24 12:33:00,1,0
specialty spice subscription box,2026-01-24 12:33:00,1,0
gourmet mushroom growing kit online,2026-01-24 12:33:00,1,0
hot sauce subscription box direct to consumer,2026-01-24 12:36:47,2,0
sustainable swimwear official site,2026-01-24 12:39:03,2,0
recycled denim jeans shop USA,2026-01-24 12:33:05,1,0
ethical linen clothing brand DTC,2026-01-24 12:33:05,1,0
sustainable activewear brand online shop,2026-01-24 12:33:05,1,0
eco-conscious lingerie online store,2026-01-24 12:40:49,2,0
sustainable plus size clothing shopify,2026-01-24 12:33:05,1,0
organic hemp clothing direct to consumer,2026-01-24 12:33:05,1,0
artisan candle direct to consumer,2026-01-24 12:33:12,1,0
sustainable baby toys shopify,2026-01-24 12:33:12,1,0
organic skincare brand USA direct,2026-01-24 12:33:12,1,0
specialty pet food online store,2026-01-24 12:33:12,1,0
luxury bath bombs online store,2026-01-24 12:33:12,1,0
ethical fashion brand direct to consumer,2026-01-24 12:33:12,1,0
gourmet chocolate gift boxes official site,2026-01-24 12:33:12,1,0
premium olive oil online store USA,2026-01-24 12:33:12,1,0
sustainable cleaning supplies shopify,2026-01-24 12:33:12,1,0
EU footwear DTC USA,2026-01-24 12:33:18,1,0
British tea company USA direct to consumer,2026-01-24 12:33:18,1,0
French lingerie brand ships to USA,2026-01-24 12:33:18,1,0
Italian leather goods official website US,2026-01-24 12:33:18,1,0
Japanese beauty products Shopify US,2026-01-24 12:33:18,1,0
Korean skincare DTC USA,2026-01-24 12:33:18,1,0
Australian pet supplies official site US,2026-01-24 12:33:18,1,0
New Zealand wool clothing online store USA,2026-01-24 12:33:18,1,0
oversized mirror direct to consumer,2026-01-24 12:38:51,2,0
large screen tv shipping problems,2026-01-24 12:33:22,1,0
bulk patio furniture ecommerce,2026-01-24 12:33:22,1,0
assembled bicycle direct to consumer,2026-01-24 12:33:22,1,0
freestanding bathtub online shop,2026-01-24 12:33:22,1,0
large dog crate shipping cost,2026-01-24 12:33:22,1,0
treadmill delivery issues,2026-01-24 12:33:22,1,0
succulent subscription box online shop,2026-01-24 12:33:28,1,0
farm fresh produce delivery shopify,2026-01-24 12:33:28,1,0
vegan meal kit delivery service,2026-01-24 12:33:28,1,0
raw dog food delivery online store,2026-01-24 12:33:28,1,0
human grade dog food subscription box,2026-01-24 12:33:28,1,0
specialty tea subscription box DTC,2026-01-24 12:33:28,1,0
organic wine subscription box USA,2026-01-24 12:33:28,1,0
fair trade cotton shirts USA,2026-01-24 12:33:34,1,0
sustainable activewear brands online,2026-01-24 12:33:34,1,0
eco-friendly lingerie shopify,2026-01-24 12:33:34,1,0
ethical cashmere sweaters shopify,2026-01-24 12:33:34,1,0
artisanal coffee subscription DTC,2026-01-24 12:33:42,1,0
eco-friendly cleaning supplies online store,2026-01-24 12:41:27,3,0
zero waste personal care shopify,2026-01-24 12:33:42,1,0
vegan protein powder official site,2026-01-24 12:33:42,1,0
gluten-free snack box subscription USA,2026-01-24 12:33:42,1,0
natural skincare products online store,2026-01-24 12:33:42,1,0
cruelty-free cosmetics DTC brand,2026-01-24 12:33:42,1,0
luxury bath bombs official site,2026-01-24 12:34:20,2,0
UK baby clothing brands shipping to USA,2026-01-24 12:33:50,1,0
EU sustainable footwear direct to consumer USA,2026-01-24 12:33:50,1,0
APAC home decor official site USA,2026-01-24 12:33:50,1,0
Australian organic skincare shopify USA,2026-01-24 12:33:50,1,0
New Zealand wool apparel DTC USA,2026-01-24 12:33:50,1,0
Scandinavian minimalist furniture online store USA,2026-01-24 12:33:50,1,0
French luxury goods shopify USA,2026-01-24 12:34:28,2,0
Italian leather accessories official site USA,2026-01-24 12:33:50,1,0
large fitness equipment Shopify,2026-01-24 12:34:00,1,0
white glove delivery consumer electronics USA,2026-01-24 12:34:00,1,0
damaged fitness equipment returns solutions,2026-01-24 12:34:00,1,0
affordable shipping bulky furniture,2026-01-24 12:34:00,1,0
direct to consumer heavy electronics,2026-01-24 12:34:00,1,0
online shop large exercise machines,2026-01-24 12:34:00,1,0
official site for sectional sofas,2026-01-24 12:34:00,1,0
e-commerce platform for oversized TVs,2026-01-24 12:34:01,1,0
organic mushroom growing kit DTC,2026-01-24 12:34:07,1,0
houseplant subscription box USA official site,2026-01-24 12:34:07,1,0
seed of the month club shopify,2026-01-24 12:34:07,1,0
gourmet spice subscription box DTC,2026-01-24 12:34:07,1,0
small batch coffee roasters subscription shopify,2026-01-24 12:34:07,1,0
tea of the month club USA official site,2026-01-24 12:34:07,1,0
artisan olive oil online store,2026-01-24 12:34:07,1,0
vinegar subscription box direct to consumer,2026-01-24 12:34:07,1,0
organic baby clothes shopify stores,2026-01-24 12:40:13,2,0
ethical shoe brands online shop,2026-01-24 12:34:12,1,0
carbon neutral clothing company,2026-01-24 12:34:13,1,0
eco-conscious jewelry online store,2026-01-24 12:34:13,1,0
sustainable denim brand USA,2026-01-24 12:34:13,1,0
fair trade knitwear online shop,2026-01-24 12:34:13,1,0
recycled fabric clothing online store,2026-01-24 12:34:13,1,0
organic cotton t-shirts DTC,2026-01-24 12:39:04,2,0
artisanal skincare official site,2026-01-24 12:34:20,1,0
luxury home fragrance shopify,2026-01-24 12:34:20,1,0
sustainable baby products DTC,2026-01-24 12:34:20,1,0
specialty food gifts shopify,2026-01-24 12:34:20,1,0
premium beard grooming products DTC,2026-01-24 12:34:20,1,0
unique stationery online store USA,2026-01-24 12:34:20,1,0
MENA fashion online store USA,2026-01-24 12:34:27,1,0
Australian outdoor gear shopify USA,2026-01-24 12:34:27,1,0
New Zealand baby products DTC USA,2026-01-24 12:34:27,1,0
Canadian pet supplies online store USA,2026-01-24 12:34:28,1,0
Scandinavian furniture brands USA,2026-01-24 12:34:28,1,0
