keyword,last_used,times_used,companies_found
MENA beauty products direct to consumer USA,2026-01-24 12:14:44,3,0
APAC electronics online store USA,2026-01-24 12:10:55,2,0
Canadian pet supplies D2C USA,2026-01-24 11:57:09,1,0
British tea online shop US delivery,2026-01-24 11:57:09,1,0
German cookware brands US online,2026-01-24 11:57:09,1,0
French linen bedding direct to consumer USA,2026-01-24 12:01:41,2,0
Italian leather goods shopify US,2026-01-24 12:12:02,3,0
large format printer official site,2026-01-24 12:14:17,3,0
sectional sofa direct to consumer,2026-01-24 12:08:15,3,0
electric scooter brands USA,2026-01-24 11:57:15,1,0
standing desk shopify store,2026-01-24 11:57:15,1,0
outdoor furniture official site,2026-01-24 12:11:37,3,0
luxury mattress online store,2026-01-24 11:57:15,1,0
premium soundbar direct to consumer,2026-01-24 11:57:15,1,0
adjustable bed frame shopify,2026-01-24 12:21:46,2,0
heavy duty shelving official site,2026-01-24 11:57:15,1,0
direct to consumer plant delivery service,2026-01-24 11:57:22,1,0
shopify perishable food gifts,2026-01-24 11:57:22,1,0
fresh seafood delivery direct to consumer,2026-01-24 11:57:22,1,0
organic mushroom growing kit shopify,2026-01-24 11:57:22,1,0
rare succulent online store,2026-01-24 11:57:22,1,0
specialty coffee bean delivery service,2026-01-24 11:57:22,1,0
craft beer of the month club online,2026-01-24 12:30:14,3,0
small batch olive oil shopify,2026-01-24 11:57:22,1,0
eco-friendly activewear brands USA,2026-01-24 11:57:29,1,0
sustainable yoga apparel direct to consumer,2026-01-24 12:06:48,3,0
organic cotton baby clothes online store,2026-01-24 11:57:29,1,0
ethical denim brands official site,2026-01-24 12:02:58,2,0
recycled swimwear shopify,2026-01-24 12:17:37,3,0
sustainable lingerie brands USA,2026-01-24 12:03:33,2,0
eco-conscious footwear online store,2026-01-24 12:02:28,2,0
organic sleepwear direct to consumer,2026-01-24 12:29:21,3,0
ethical workwear brands official site,2026-01-24 11:57:29,1,0
recycled plastic sunglasses shopify,2026-01-24 12:41:21,2,0
premium coffee subscription box DTC,2026-01-24 12:16:07,2,0
artisanal spice blends online store,2026-01-24 11:57:33,1,0
gourmet olive oil shopify official site,2026-01-24 11:57:33,1,0
organic tea blends online shop USA,2026-01-24 11:57:34,1,0
luxury scented candles official website,2026-01-24 11:57:34,1,0
handmade soap and skincare DTC,2026-01-24 11:57:34,1,0
sustainable bamboo toothbrush shopify,2026-01-24 11:57:34,1,0
eco-friendly cleaning products online store,2026-01-24 12:04:46,3,0
natural pet food direct to consumer brand,2026-01-24 11:57:34,1,0
UK beauty products US distribution,2026-01-24 11:57:39,1,0
EU handmade jewelry online shop US,2026-01-24 11:57:39,1,0
Australian supplements official website USA,2026-01-24 11:57:39,1,0
Canadian outdoor gear DTC US fulfillment,2026-01-24 12:00:05,2,0
New Zealand skincare Shopify US warehouse,2026-01-24 11:57:39,1,0
Japanese stationery direct to consumer US,2026-01-24 12:16:14,2,0
Korean cosmetics online store US shipping,2026-01-24 11:57:39,1,0
French linen bedding US official site,2026-01-24 11:57:39,1,0
German kitchen gadgets DTC US,2026-01-24 11:57:39,1,0
oversized bean bag chair online store,2026-01-24 12:19:38,3,0
heavy duty shelving units direct to consumer,2026-01-24 12:02:46,2,0
sectional sofa online shop USA,2026-01-24 11:57:46,1,0
electric bicycle DTC,2026-01-24 11:57:46,1,0
adjustable standing desk online store,2026-01-24 11:57:46,1,0
portable air conditioner direct to consumer,2026-01-24 12:21:46,2,0
outdoor furniture set shopify,2026-01-24 11:57:46,1,0
king size mattress online shop USA,2026-01-24 11:57:46,1,0
fresh meal kit delivery service,2026-01-24 12:16:59,2,0
gourmet cookie subscription box online,2026-01-24 11:57:51,1,0
artisan cheese of the month club direct to consumer,2026-01-24 11:57:51,1,0
rare plant subscription box USA shopify,2026-01-24 11:57:51,1,0
exotic fruit delivery official site,2026-01-24 12:17:31,3,0
craft beer of the month club delivery,2026-01-24 12:23:25,2,0
organic spice subscription box USA,2026-01-24 12:08:51,3,0
edible flower delivery service,2026-01-24 11:57:51,1,0
eco-friendly yoga clothing online store,2026-01-24 12:14:32,3,0
sustainable swimwear brands USA direct to consumer,2026-01-24 11:59:26,2,0
ethical lingerie online shop,2026-01-24 12:31:26,2,0
fair trade apparel official site,2026-01-24 11:57:59,1,0
sustainable plus size clothing online store,2026-01-24 12:27:07,2,0
eco-friendly kids clothing brands USA,2026-01-24 11:57:59,1,0
organic linen clothing direct to consumer,2026-01-24 11:57:59,1,0
recycled polyester activewear shopify,2026-01-24 12:18:42,3,0
artisanal coffee roasters online store,2026-01-24 12:22:41,2,0
small batch skincare direct to consumer,2026-01-24 12:09:42,3,0
premium pet food brands USA,2026-01-24 11:58:07,1,0
handcrafted jewelry official site,2026-01-24 12:36:58,2,0
sustainable home goods store,2026-01-24 11:58:07,1,0
organic baby clothing shopify,2026-01-24 11:58:07,1,0
unique stationery online store,2026-01-24 11:58:07,1,0
luxury bedding official site,2026-01-24 12:37:28,3,0
EU pet supplies direct to consumer USA,2026-01-24 11:58:12,1,0
MENA fashion online store US,2026-01-24 12:18:22,3,0
APAC beauty products official site US,2026-01-24 11:58:12,1,0
Australian swimwear brand US distribution,2026-01-24 11:58:12,1,0
Canadian outdoor gear shopify US,2026-01-24 12:13:37,3,0
British tea brand US warehouse,2026-01-24 11:58:12,1,0
German auto parts online store USA,2026-01-24 11:58:12,1,0
French baby clothing direct to consumer US,2026-01-24 12:13:07,3,0
Italian leather goods US fulfillment,2026-01-24 11:58:12,1,0
oversized item shipping solutions direct to consumer,2026-01-24 12:25:51,2,0
bulk fitness equipment shopify,2026-01-24 11:58:17,1,0
assembled furniture delivery service,2026-01-24 11:58:17,1,0
white glove delivery furniture brand,2026-01-24 11:58:17,1,0
in home assembly fitness equipment online store,2026-01-24 11:58:17,1,0
heavy item shipping quotes ecommerce,2026-01-24 11:58:17,1,0
difficult to ship products online,2026-01-24 11:58:17,1,0
fragile electronics online retailer,2026-01-24 11:58:17,1,0
large screen tv shipping company,2026-01-24 11:58:17,1,0
gourmet mushroom grow kit subscription DTC,2026-01-24 11:58:23,1,0
microgreens delivery service online store,2026-01-24 12:32:25,2,0
artisan cheese subscription box USA official site,2026-01-24 12:41:47,3,0
fresh pasta subscription shopify,2026-01-24 12:27:33,2,0
sourdough bread baking kit subscription online store,2026-01-24 11:58:23,1,0
specialty coffee bean subscription box USA official site,2026-01-24 12:22:29,2,0
rare plant subscription box online store,2026-01-24 12:18:05,3,0
succulent subscription box shopify,2026-01-24 12:16:27,2,0
air plant subscription box DTC,2026-01-24 11:58:23,1,0
eco-friendly swimwear brands USA,2026-01-24 11:58:28,1,0
organic cotton baby clothes DTC,2026-01-24 12:23:03,3,0
ethical men's fashion official site,2026-01-24 11:58:28,1,0
recycled plastic shoes shopify,2026-01-24 11:58:28,1,0
vegan leather handbags online,2026-01-24 12:38:26,3,0
sustainable activewear brands USA,2026-01-24 12:21:26,2,0
fair trade jewelry online store,2026-01-24 11:58:28,1,0
organic bedding DTC,2026-01-24 11:58:29,1,0
eco-friendly home decor official site,2026-01-24 11:58:29,1,0
artisanal coffee beans online store USA,2026-01-24 11:59:58,3,0
premium tea subscription box Shopify,2026-01-24 11:58:34,1,0
small batch hot sauce official site,2026-01-24 12:16:07,3,0
organic baby food delivery DTC,2026-01-24 12:08:33,2,0
sustainable pet supplies online shop,2026-01-24 11:58:34,1,0
eco-friendly cleaning products Shopify store,2026-01-24 11:58:34,1,0
handmade jewelry official website USA,2026-01-24 12:36:34,2,0
unique home decor online store,2026-01-24 11:58:34,1,0
UK skincare brands shipping to US,2026-01-24 12:05:25,3,0
EU pet supplies DTC USA,2026-01-24 11:58:40,1,0
Australian swimwear online store US,2026-01-24 12:16:46,3,0
MENA beauty products official site USA,2026-01-24 12:25:13,2,0
Nordic home goods Shopify US,2026-01-24 11:58:40,1,0
German kitchenware direct to consumer US,2026-01-24 12:20:31,2,0
French baby clothing online shop USA,2026-01-24 12:08:07,3,0
Italian leather goods DTC US,2026-01-24 12:25:13,2,0
Spanish shoes official site USA,2026-01-24 11:58:40,1,0
Japanese stationery Shopify US,2026-01-24 11:58:40,1,0
heavy duty treadmill official site,2026-01-24 11:58:45,1,0
king size mattress in a box,2026-01-24 11:58:45,1,0
weightlifting equipment shopify,2026-01-24 12:26:21,3,0
outdoor patio furniture online retailer,2026-01-24 11:58:45,1,0
home theater seating official website,2026-01-24 11:58:45,1,0
electric scooter d2c,2026-01-24 11:58:45,1,0
ceramic grill kamado online shop,2026-01-24 11:58:45,1,0
adjustable dumbbells set direct to consumer,2026-01-24 11:58:45,1,0
fresh pasta subscription box official site,2026-01-24 12:25:58,2,0
microgreens subscription box USA,2026-01-24 12:19:45,3,0
organic spice blends online shop,2026-01-24 12:35:13,3,0
exotic fruit delivery box service,2026-01-24 11:58:51,1,0
craft chocolate subscription box DTC,2026-01-24 12:21:19,2,0
rare tea blends online store,2026-01-24 11:58:51,1,0
gourmet mushroom growing kit subscription,2026-01-24 12:24:54,2,0
sustainable swimwear DTC,2026-01-24 12:41:21,3,0
organic cotton baby clothes USA shopify,2026-01-24 12:23:28,3,0
recycled polyester activewear direct to consumer,2026-01-24 12:13:54,2,0
vegan leather handbags online shop,2026-01-24 12:33:34,2,0
sustainable denim jeans DTC,2026-01-24 12:37:20,3,0
eco-friendly t-shirts online shop,2026-01-24 11:58:55,1,0
luxury skincare official site,2026-01-24 11:59:02,1,0
handmade jewelry online store USA,2026-01-24 12:08:33,3,0
specialty coffee roasters online shop,2026-01-24 11:59:02,1,0
gourmet food gifts direct to consumer,2026-01-24 12:01:34,3,0
artisan chocolate official site,2026-01-24 12:23:34,3,0
high-end tea brands shopify,2026-01-24 11:59:02,1,0
UK skincare brands shipping to US official site,2026-01-24 12:31:40,2,0
Australian swimwear online store US shipping,2026-01-24 12:25:13,2,0
German footwear direct to consumer USA,2026-01-24 11:59:08,1,0
French baby clothing brands US warehouse,2026-01-24 11:59:08,1,0
Japanese beauty products official website USA,2026-01-24 11:59:08,1,0
European home decor online shop USA,2026-01-24 11:59:08,1,0
Scandinavian furniture Shopify US shipping,2026-01-24 11:59:08,1,0
Australian coffee beans online store USA,2026-01-24 11:59:08,1,0
UK tea brands direct to consumer USA,2026-01-24 11:59:08,1,0
oversized electronics online store,2026-01-24 11:59:15,1,0
commercial fitness equipment direct to consumer,2026-01-24 11:59:15,1,0
bulk patio furniture official site,2026-01-24 11:59:15,1,0
large screen TV shipping cost,2026-01-24 11:59:15,1,0
treadmills for home use DTC,2026-01-24 12:37:09,2,0
gaming chairs shopify store,2026-01-24 12:29:07,2,0
heavy appliance delivery service,2026-01-24 12:03:20,2,0
weighted blankets online retailer,2026-01-24 11:59:15,1,0
artisan bread delivery service direct to consumer,2026-01-24 12:38:20,2,0
small batch coffee roasters shopify,2026-01-24 11:59:21,1,0
organic spice blends direct to consumer,2026-01-24 12:05:03,2,0
microgreen growing kit subscription online store,2026-01-24 12:26:27,2,0
air purifying plant delivery service DTC,2026-01-24 11:59:21,1,0
exotic fruit box online store,2026-01-24 11:59:21,1,0
specialty mushroom growing kit direct to consumer,2026-01-24 11:59:21,1,0
recycled plastic activewear brand USA,2026-01-24 11:59:26,1,0
carbon neutral shoe brand official site,2026-01-24 11:59:26,1,0
sustainable denim brand online,2026-01-24 11:59:26,1,0
eco conscious maternity wear shopify,2026-01-24 12:16:02,2,0
organic cotton underwear online store,2026-01-24 12:14:32,2,0
ethical workwear brand DTC,2026-01-24 11:59:26,1,0
luxury skincare products shopify store,2026-01-24 11:59:30,1,0
handmade jewelry online shop USA,2026-01-24 11:59:30,1,0
organic baby clothing online store,2026-01-24 12:09:03,2,0
ethical fashion online shopify plus,2026-01-24 11:59:30,1,0
specialty pet food direct to consumer,2026-01-24 11:59:30,1,0
high-end kitchenware official site,2026-01-24 11:59:30,1,0
premium spice blends online shop,2026-01-24 12:27:47,2,0
UK skincare brands US shipping,2026-01-24 12:21:39,3,0
EU furniture online store USA,2026-01-24 11:59:36,1,0
Australian swimwear DTC USA,2026-01-24 11:59:36,1,0
MENA beauty products official site US,2026-01-24 11:59:36,1,0
Korean fashion online store US,2026-01-24 11:59:36,1,0
French linen bedding US warehouse,2026-01-24 11:59:36,1,0
Spanish baby shoes online store USA,2026-01-24 11:59:36,1,0
Nordic home decor official site US,2026-01-24 11:59:36,1,0
heavy furniture delivery service USA,2026-01-24 11:59:43,1,0
bulk consumer electronics direct to consumer,2026-01-24 12:38:15,2,0
sectional sofas free shipping,2026-01-24 12:32:18,2,0
treadmills online store,2026-01-24 11:59:43,1,0
big screen tvs dtc,2026-01-24 11:59:43,1,0
adjustable beds shopify,2026-01-24 11:59:43,1,0
refrigerators online store,2026-01-24 12:25:21,2,0
fresh pasta subscription online store,2026-01-24 12:11:43,3,0
specialty coffee bean subscription Shopify,2026-01-24 12:14:55,3,0
craft beer of the month club USA,2026-01-24 12:20:14,3,0
wine subscription box direct to consumer,2026-01-24 12:16:27,3,0
organic fruit delivery box USA official site,2026-01-24 11:59:48,1,0
exotic fruit subscription box online,2026-01-24 12:11:10,3,0
mushroom growing kit subscription service,2026-01-24 11:59:48,1,0
bonsai tree subscription box USA,2026-01-24 11:59:48,1,0
eco friendly women's clothing online store USA,2026-01-24 12:37:57,3,0
organic cotton baby clothes official site USA,2026-01-24 12:06:48,2,0
recycled swimwear brands online shop,2026-01-24 11:59:53,1,0
ethical lingerie store USA,2026-01-24 11:59:53,1,0
vegan leather handbags shopify store,2026-01-24 11:59:53,1,0
fair trade clothing brand USA official site,2026-01-24 11:59:53,1,0
sustainable men's fashion online store,2026-01-24 12:04:07,2,0
eco friendly activewear brand direct to consumer,2026-01-24 11:59:53,1,0
gourmet food gifts online official site,2026-01-24 11:59:58,1,0
eco-friendly cleaning products DTC brand,2026-01-24 11:59:58,1,0
luxury candles official site,2026-01-24 11:59:58,1,0
handmade jewelry online shopify,2026-01-24 11:59:58,1,0
premium olive oil direct to consumer,2026-01-24 12:11:43,3,0
UK baby clothing brands shipping to US,2026-01-24 12:03:48,3,0
EU sustainable shoe brands US warehouse,2026-01-24 12:00:05,1,0
APAC handmade jewelry online store USA,2026-01-24 12:32:12,2,0
European organic baby food shopify USA,2026-01-24 12:00:05,1,0
British tea brands direct to consumer USA,2026-01-24 12:14:44,2,0
German leather goods online shop USA,2026-01-24 12:00:05,1,0
French skincare official website US,2026-01-24 12:00:05,1,0
large format porcelain tile online store,2026-01-24 12:00:11,1,0
oversized sectional sofas direct to consumer,2026-01-24 12:00:11,1,0
freestanding bathtubs shopify,2026-01-24 12:00:11,1,0
heavy duty shelving units online retailer,2026-01-24 12:00:11,1,0
solid wood dining tables DTC,2026-01-24 12:00:11,1,0
assembled kitchen cabinets online store,2026-01-24 12:00:11,1,0
commercial grade blenders shopify,2026-01-24 12:00:11,1,0
electric fireplaces direct to consumer,2026-01-24 12:17:59,2,0
adjustable height standing desks official site,2026-01-24 12:00:11,1,0
outdoor patio furniture sets online retailer,2026-01-24 12:00:11,1,0
gourmet mushroom growing kit subscription box,2026-01-24 12:12:46,3,0
artisan cheese monthly delivery official site,2026-01-24 12:00:16,1,0
fresh pasta subscription service USA,2026-01-24 12:00:16,1,0
exotic fruit delivery subscription shopify,2026-01-24 12:00:16,1,0
craft jerky subscription box direct to consumer,2026-01-24 12:40:42,2,0
organic sourdough starter kit subscription,2026-01-24 12:00:16,1,0
edible flower subscription box USA,2026-01-24 12:00:16,1,0
organic cotton baby clothes shopify usa,2026-01-24 12:00:22,1,0
ethical linen clothing official site,2026-01-24 12:13:54,3,0
recycled polyester activewear brands,2026-01-24 12:36:21,3,0
fair trade denim jeans online store,2026-01-24 12:00:22,1,0
vegan leather handbags dtc,2026-01-24 12:00:22,1,0
bamboo clothing brands usa online,2026-01-24 12:00:22,1,0
sustainable sleepwear official site,2026-01-24 12:00:22,1,0
eco friendly kids clothing shopify,2026-01-24 12:00:22,1,0
organic hemp clothing brands usa,2026-01-24 12:00:22,1,0
recycled nylon swimwear direct to consumer,2026-01-24 12:00:22,1,0
artisan chocolate shopify,2026-01-24 12:00:28,1,0
luxury candle brands usa,2026-01-24 12:00:28,1,0
organic baby clothing official site,2026-01-24 12:17:37,3,0
high-end pet supplies shopify,2026-01-24 12:30:58,2,0
specialty tea online store,2026-01-24 12:21:31,2,0
personalized gifts official site,2026-01-24 12:21:31,3,0
unique stationery shopify,2026-01-24 12:00:28,1,0
UK skincare brand US distribution,2026-01-24 12:00:37,1,0
EU organic baby food online shop USA,2026-01-24 12:00:37,1,0
MENA luxury dates official site US,2026-01-24 12:00:37,1,0
APAC sustainable swimwear direct to consumer US,2026-01-24 12:00:37,1,0
Australian coffee beans US warehouse,2026-01-24 12:00:37,1,0
New Zealand wool apparel Shopify USA,2026-01-24 12:00:37,1,0
Canadian outdoor gear brand USA fulfillment,2026-01-24 12:00:37,1,0
European bicycle accessories online store USA,2026-01-24 12:00:37,1,0
German auto parts DTC USA,2026-01-24 12:00:37,1,0
heavy furniture online store usa,2026-01-24 12:25:51,3,0
oversized electronics dtc brands,2026-01-24 12:00:45,1,0
treadmills for home use shopify,2026-01-24 12:17:59,3,0
outdoor patio furniture online store,2026-01-24 12:23:19,3,0
gaming chairs dtc brands,2026-01-24 12:00:45,1,0
mattress in a box direct to consumer,2026-01-24 12:00:45,1,0
fresh pasta subscription box direct to consumer,2026-01-24 12:41:47,2,0
organic microgreens delivery shopify,2026-01-24 12:00:53,1,0
rare fruit subscription box official site,2026-01-24 12:00:53,1,0
heirloom tomato plants online shop,2026-01-24 12:00:53,1,0
exotic pepper plants direct to consumer,2026-01-24 12:00:53,1,0
herb garden subscription box USA,2026-01-24 12:00:53,1,0
medicinal mushroom grow kit shopify,2026-01-24 12:00:53,1,0
air purifying plants subscription box online,2026-01-24 12:00:53,1,0
eco-friendly bridesmaid dresses online store,2026-01-24 12:10:43,3,0
sustainable lingerie brands DTC,2026-01-24 12:00:58,1,0
organic baby clothes shopify USA,2026-01-24 12:41:21,3,0
ethical men's workwear official site,2026-01-24 12:00:58,1,0
carbon neutral activewear brand,2026-01-24 12:00:58,1,0
sustainable swimwear brands USA online,2026-01-24 12:00:58,1,0
eco-conscious maternity clothes online shop,2026-01-24 12:00:58,1,0
recycled denim jeans direct to consumer,2026-01-24 12:00:58,1,0
fair trade clothing brands official site,2026-01-24 12:02:28,2,0
sustainable yoga apparel shopify,2026-01-24 12:00:58,1,0
gourmet spice blends online store USA,2026-01-24 12:12:58,3,0
artisanal candle subscription box direct to consumer,2026-01-24 12:01:04,1,0
premium coffee beans direct to consumer shopify,2026-01-24 12:01:04,1,0
small batch skincare official site,2026-01-24 12:01:04,1,0
luxury pet supplies online store,2026-01-24 12:01:04,1,0
handcrafted jewelry direct to consumer,2026-01-24 12:06:21,2,0
specialty tea blends online shopify,2026-01-24 12:01:04,1,0
eco-friendly cleaning products ecommerce,2026-01-24 12:01:04,1,0
UK fashion brand US shipping,2026-01-24 12:26:15,2,0
EU cosmetics direct to consumer USA,2026-01-24 12:10:22,3,0
Australian supplements official site US,2026-01-24 12:01:10,1,0
MENA home decor online store USA,2026-01-24 12:01:10,1,0
Scandinavian furniture Shopify US,2026-01-24 12:36:03,2,0
British tea company US warehouse,2026-01-24 12:01:10,1,0
German auto parts ecommerce US,2026-01-24 12:01:10,1,0
French skincare DTC USA,2026-01-24 12:01:10,1,0
Italian leather goods US delivery,2026-01-24 12:01:10,1,0
Japanese stationery online shop USA,2026-01-24 12:24:42,2,0
oversized consumer electronics DTC,2026-01-24 12:34:00,2,0
treadmills official site,2026-01-24 12:21:13,3,0
weight benches direct to consumer,2026-01-24 12:25:21,3,0
home gym equipment USA,2026-01-24 12:01:17,1,0
king size mattresses DTC,2026-01-24 12:01:17,1,0
refrigerators official site,2026-01-24 12:01:17,1,0
elliptical machines direct to consumer,2026-01-24 12:09:55,3,0
patio furniture shopify,2026-01-24 12:01:17,1,0
gourmet mushroom grow kit subscription box online,2026-01-24 12:01:23,1,0
fresh pasta subscription delivery service,2026-01-24 12:01:23,1,0
organic spice blend subscription box shopify,2026-01-24 12:38:21,2,0
rare plant cuttings subscription box,2026-01-24 12:01:23,1,0
air plant subscription box online store,2026-01-24 12:05:36,3,0
houseplant of the month club official site,2026-01-24 12:01:23,1,0
small batch olive oil subscription box online,2026-01-24 12:01:23,1,0
ethical jewelry official site,2026-01-24 12:36:53,3,0
recycled material backpacks online,2026-01-24 12:01:29,1,0
vegan leather handbags DTC,2026-01-24 12:15:00,2,0
fair trade clothing brands USA,2026-01-24 12:01:29,1,0
bamboo socks shopify,2026-01-24 12:01:29,1,0
eco-conscious activewear official site,2026-01-24 12:01:29,1,0
organic sleepwear brands USA,2026-01-24 12:25:00,3,0
premium cookware direct to consumer,2026-01-24 12:20:24,3,0
luxury bedding sets online store USA,2026-01-24 12:01:34,1,0
artisanal coffee roasters shopify,2026-01-24 12:01:34,1,0
high-end skincare official site,2026-01-24 12:20:24,2,0
specialty pet supplies online store,2026-01-24 12:39:44,2,0
sustainable baby products shopify plus,2026-01-24 12:01:35,1,0
eco-friendly home goods official site,2026-01-24 12:01:35,1,0
small batch apparel brands USA,2026-01-24 12:01:35,1,0
UK direct to consumer beauty products US shipping,2026-01-24 12:01:41,1,0
EU artisan coffee roasters US online store,2026-01-24 12:01:41,1,0
Australian sustainable swimwear brands ship USA,2026-01-24 12:01:41,1,0
MENA luxury dates online shop USA,2026-01-24 12:01:41,1,0
Japanese skincare DTC official site US,2026-01-24 12:01:41,1,0
Korean stationery online store US,2026-01-24 12:01:41,1,0
German handcrafted wooden toys US shopify,2026-01-24 12:01:41,1,0
Italian leather goods US online boutique,2026-01-24 12:01:41,1,0
Spanish espadrilles direct to consumer US,2026-01-24 12:01:41,1,0
heavy furniture direct to consumer,2026-01-24 12:24:18,2,0
oversized item shipping solutions ecommerce,2026-01-24 12:01:49,1,0
large appliance online store usa,2026-01-24 12:01:49,1,0
bulky goods delivery company,2026-01-24 12:01:49,1,0
commercial treadmill online shop,2026-01-24 12:01:49,1,0
home gym equipment dtc,2026-01-24 12:01:49,1,0
sectional sofa online store,2026-01-24 12:28:03,3,0
king size mattress in a box brands,2026-01-24 12:06:00,2,0
adjustable bed frame online retailer,2026-01-24 12:01:49,1,0
gourmet mushroom growing kit subscription DTC,2026-01-24 12:32:25,2,0
rare cheese subscription box online store,2026-01-24 12:01:55,1,0
exotic fruit delivery service USA,2026-01-24 12:41:15,3,0
artisan bread subscription box Shopify,2026-01-24 12:01:55,1,0
fresh pasta subscription box online,2026-01-24 12:08:51,2,0
organic spice blend subscription box USA,2026-01-24 12:01:55,1,0
vegan meal kit subscription box Shopify,2026-01-24 12:01:55,1,0
gluten-free baked goods subscription box DTC,2026-01-24 12:01:55,1,0
eco friendly baby clothes online store,2026-01-24 12:01:59,1,0
organic cotton apparel shopify store,2026-01-24 12:01:59,1,0
ethical yoga wear official site,2026-01-24 12:10:43,2,0
sustainable fashion brands USA online,2026-01-24 12:01:59,1,0
eco conscious clothing boutique online,2026-01-24 12:01:59,1,0
carbon neutral apparel company,2026-01-24 12:01:59,1,0
sustainable denim shopify store,2026-01-24 12:01:59,1,0
organic linen clothing online shop,2026-01-24 12:01:59,1,0
sustainable kids clothes direct to consumer,2026-01-24 12:01:59,1,0
luxury aromatherapy diffuser direct to consumer,2026-01-24 12:02:05,1,0
premium skincare routine sets online store,2026-01-24 12:02:05,1,0
gourmet coffee bean subscription box shopify,2026-01-24 12:02:05,1,0
artisanal chocolate gift baskets USA,2026-01-24 12:02:05,1,0
sustainable home decor official site,2026-01-24 12:02:05,1,0
high-end pet supplies online store,2026-01-24 12:02:05,1,0
unique spice blends direct to consumer,2026-01-24 12:41:27,2,0
specialty tea blends online store,2026-01-24 12:39:12,2,0
UK skincare brand USA official site,2026-01-24 12:40:28,2,0
EU jewelry direct to consumer USA,2026-01-24 12:02:12,1,0
Australian swimwear online store USA,2026-01-24 12:25:45,3,0
German kitchenware DTC brand USA,2026-01-24 12:02:12,1,0
Italian leather goods direct to consumer USA,2026-01-24 12:32:45,3,0
Japanese stationery official website USA,2026-01-24 12:02:13,1,0
Korean beauty products shopify USA,2026-01-24 12:02:13,1,0
Nordic furniture design online store USA,2026-01-24 12:02:13,1,0
oversized electronics direct to consumer,2026-01-24 12:08:45,3,0
large fitness equipment official site,2026-01-24 12:28:37,3,0
bulk patio furniture shopify,2026-01-24 12:16:21,2,0
residential safe online store,2026-01-24 12:02:18,1,0
at home sauna direct to consumer,2026-01-24 12:02:18,1,0
large format printer online store,2026-01-24 12:02:18,1,0
commercial blender online store,2026-01-24 12:02:18,1,0
industrial shelving official site,2026-01-24 12:02:18,1,0
fresh pasta delivery subscription DTC,2026-01-24 12:02:23,1,0
rare fruit subscription box shopify,2026-01-24 12:02:23,1,0
exotic spice subscription box direct to consumer,2026-01-24 12:02:23,1,0
